0,1,2,3
Muda hopes for institutional reform with new cabinet lineup,"KUALA LUMPUR: With the announcement of the fresh Cabinet lineup, Malaysian United Democratic Alliance (Muda) expressed hope that the current lineup will implement institutional reform.",2023-12-13,Politics
Ramkarpal's voluntary resignation to eliminate nepotism,"KUALA LUMPUR: Paving the way for his elder brother, Gobind Singh Deo, Ramkarpal Singh's voluntary move shows DAP's dedication to eliminating nepotism within the party. ",2023-12-13,Politics
Pas veep: Anwar's new cabinet proves earlier promises were empty rhetoric,"KOTA BARU: Pas believes that the Prime Minister’s promises to reduce the size of the cabinet and expenses when he took over the government last year, was just empty rhetoric.",2023-12-13,Politics
Pas issues ultimatum to party reps: Support Anwar and you're out,"KUALA LUMPUR: Pas representatives are warned that they will be dismissed if they provide support to the Prime Minister, Datuk Seri Anwar Ibrahim.",2023-12-12,Politics
Kit Siang must change his style of politics - Kedah Umno Info chief,ALOR STAR: Kedah Umno Information chief Datuk Shaiful Hazizy Zainol Abidin has fired a salvo at DAP veteran Tan Sri Lim Kit Siang over his remarks that the Federal Constitution does not prevent any non-Malay from becoming prime minister.,2023-12-11,Politics
Bersatu confident no more MPs will support Anwar,KUALA LUMPUR: Parti Pribumi Bersatu Malaysia (Bersatu) said no more members of parliament (MP) from their party would declare support for the Prime Minister.,2023-12-11,Politics
Pas: Kit Siang's Malaysian Dream a poisonous propaganda,KUALA LUMPUR: The recent controversial remark by DAP veteran Lim Kit Siang on the ‘Malaysian Dream’ has been dubbed as poisonous propaganda by Pas.,2023-12-11,Politics
Bukit Gantang MP claims 7 or 8 PN MPs will declare their support for Anwar soon,PETALING JAYA: Bukit Gantang member of Parliament (MP) Datuk Syed Abu Hussin Hafiz Syed Abdul Fasal today claimed that several more MPs from Perikatan Nasional (PN) will express their support for Datuk Seri Anwar Ibrahim soon.,2023-12-11,Politics
Ipoh court dismisses Gombak Setia election petition appeal,KUALA LUMPUR: Perikatan Nasional’s Muhammad Hilman Idham will remain as Gombak Setia assemblyman after the Ipoh High Court dismissed an election petition brought by Mohd Shaffie Omar.,2023-12-11,Politics
"Anwar: No more 'tebuk atap' moves, government to remain strong","KUALA LUMPUR: One year on, Prime Minister Datuk Seri Anwar Ibrahim is confident that there will not be any more ‘tebuk atap’ movements to topple the government.  ",2023-12-10,Politics
PH-BN unity at federal level sets stage for Johor DAP-Umno alliance in 16th State Elections,"KLUANG: The unity government coalition parties Pakatan Harapan (PH) Barisan Nasional (BN) collaborations, pave solid groundwork for DAP and Umno Johor to establish a united force in the 16th General Elections.",2023-12-10,Politics
"Support for unity govt from civil servants continues to rise, says Amanah president",SUNGAI BULOH: Perikatan Nasional (PN) is forced to swallow their own words after their narrative that the unity government will collapse after the Aug 12 state elections never materialised.,2023-12-10,Politics
"GRS must contest in all 73 state seats in Sabah, says Pandikar Amin","KOTA KINABALU: Gabungan Rakyat Sabah (GRS) has to contest in all 73 state seats in Sabah, said United Sabah Nasional Organisation (USNO) president Tan Sri Pandikar Amin Mulia.",2023-12-10,Politics
Amanah VP denies faction existence claims,IPOH: Parti Amanah Negara (Amanah) vice-president Datuk Seri Dr Mujahid Yusof Rawa has dismissed claims of existence of a faction within the party. ,2023-12-10,Politics
'Kit Siang did not learn from history',"ALOR STAR: DAP veteran Lim Kit Siang has shown his true colours by saying that the Federal Constitution does not bar non-Malay to be a prime minister, said Umno supreme council member Datuk Hasmuni Hassan.",2023-12-10,Politics
Amanah and PH allies must restore Malay voter support in GE16,SUNGAI BULOH: Parti Amanah Negara (Amanah) alongside its allies in the Pakatan Harapan (PH) pact including DAP must find ways to restore and win the support of the Malay voters in the next general election.,2023-12-10,Politics
PM holds prerogative to appoint new minister,IPOH: The sole authority to determine the appointment of a new Minister of Domestic Trade and Cost of Living to succeed the late Datuk Seri Salahuddin Ayub belongs to Prime Minister Datuk Seri Anwar Ibrahim.,2023-12-10,Politics
"Isham's dismissal finalised by Supreme Council, no need for further investigation, says Zahid","KUALA LUMPUR - The sacking of Hizatul Isham Jalil from Umno last night is an unequivocal decision, says party president Datuk Seri Dr Ahmad Zahid Hamidi.",2023-12-09,Politics
Khaled: Isham was sacked due to him undermining party's integrity,KOTA TINGGI:  Sacked Umno supreme council member Isham Jalil was dismissed from the party because he crossed the line by undermining the party's integrity.,2023-12-09,Politics
'Umno president made unilateral decision; I won't appeal' says sacked Isham,KUALA LUMPUR: Recently sacked Umno Supreme Council member Isham Jalil said that he would not appeal the party’s decision.,2023-12-09,Politics
'Umno president made unilateral decision; I won't appeal' says sacked Isham,KUALA LUMPUR: Recently sacked Umno Supreme Council member Isham Jalil said that he would not appeal the party’s decision.,2023-12-09,Politics
Umno Youth chief cautions Lian Ker not to 'play the race card',"MELAKA: Umno Youth chief, Dr Muhamad Akmal Saleh, cautioned a former MCA leader that the Bumiputera Economic Congress, which has been implemented since the time of the Barisan Nasional (BN) government, has never encroached upon or suppressed the rights of other communities.",2023-12-09,Politics
Isham Jalil confirms sacking from Umno,KUALA LUMPUR: Umno Supreme Council Isham Jalil has confirmed that he has received an official letter of his sacking from the party.,2023-12-09,Politics
Kedah Amanah lodges police report against Hadi for likening Madani govt to Israeli govt,ALOR STAR: Kedah Parti Amanah Negara (Amanah) has lodged a police report against Pas president Tan Sri Abdul Hadi Awang for allegedly likening the Madani government to the Israeli government. ,2023-12-08,Politics
Umno president admits the party is in a weak state,KUALA LUMPUR: Umno president Datuk Seri Dr Ahmad Zahid Hamidi has acknowledged that the party is in a weak state following its defeat in the 2018 General Election. ,2023-12-08,Politics
"Official letter on Isham's sacking will be issued soon, says Zahid","KUALA LUMPUR: Umno will issue an official letter on the sacking of its supreme council member Isham Jalil, which had been decided  on Wednesday.",2023-12-08,Politics
"Official letter on Isham's sacking will be issued soon, says Zahid",news@nst.com.my ,2023-12-08,Politics
Opposition MP support for PM does not violate Anty-Party Hopping Act - Azalina [NSTTV],"KUALA LUMPUR: The action of several Members of Parliament (MPs) from the opposition bloc in pledging their support to Prime Minister Datuk Seri Anwar Ibrahim and the Unity Government recently does not violate the Anti-Party Hopping or the Constitution (Amendment) Act (No.3) 2022 (Act A1663), said Minister in the Prime Minister’s Department (Law and Institutional Reform) Datuk Seri Azalina Othman Said.",2023-12-07,Politics
I resigned to make way for a new leadership - Ahmad,"KUALA TERENGGANU: Former Terengganu Menteri Besar, Datuk Seri Dr Ahmad Said said his decision to resign as the Terengganu Umno liaison committee chairman was made to pave the way for a younger generation to lead the party.",2023-12-07,Politics
"PKR Youth wing lauds decentralising a VC's power in AUKU amendment, but is wary about limiting student council membership",ALOR STAR: PKR’s Youth wing lauded the government’s move to decentralise a university’s vice-chancellor power pertaining to disciplinary action on students as proposed in the University and College Act 1971 (AUKU) amendment 2023 bill.,2023-12-07,Politics
"Umno still commands support of Malay voters, says Kedah Umno info chief","ALOR STAR: Umno has never lost the support of Malay voters as candidates from the party have never lost their deposit either in the general election, state election or by-election. ",2023-12-07,Politics
Onn Hafiz's appointment as Johor Umno head reflects state party's benchmark of excellence,JOHOR BARU: Datuk Onn Hafiz Ghazi’s appointment as Johor Umno liaison committee chairman reflects the state party’s benchmark of excellence.,2023-12-07,Politics
Isham: I have been kicked out of the Umno Supreme Council WhatsApp group,"KUALA LUMPUR: Embattled former Umno information chief Isham Jalil, who was reportedly sacked from the party, said he has yet to receive any notice over his termination.",2023-12-07,Politics
"Zahid is delusional, says Wan Fayhsal",KUALA LUMPUR: A top Perikatan Nasional (PN) leader has told Datuk Seri Dr Ahmad Zahid Hamidi to be prepared for the demise of Umno in the country's political scene.,2023-12-07,Politics
Onn Hafiz is new Johor Umno chief,KUALA LUMPUR: Datuk Onn Hafiz Ghazi has been appointed as the new Johor Umno liaison committee chairman with immediate effect.,2023-12-07,Politics
"Isham asked for Umno to take action against him to boost his popularity, said Supreme Council member [NSTTV]","KUALA LUMPUR: Isham Jalil is asking for the action to be brought against him as a means to boost himself, said Umno Supreme Council Datuk Mohd Razlan Rafii.",2023-12-06,Politics
"Umno MPs and assemblymen stand firm in support of Anwar, unity govt",KUALA LUMPUR: Umno will continue to strengthen and uphold the unity government.,2023-12-06,Politics
Isham Jalil sacked from Umno?,"KUALA LUMPUR: Is Umno Supreme Council member Isham Jalil still an Umno member, or has he been sacked from the Malay party?",2023-12-06,Politics
Umno leaders gather at Menara Dato Onn for Supreme Council meeting,KUALA LUMPUR: Several Umno leaders have arrived at Menara Dato Onn here tonight ahead of its Supreme Council Meeting.,2023-12-06,Politics
Perak PKR veep keeps mum on three opposition assemblyman supporting Saarani,IPOH: Perak PKR vice-chairman Muhamad Arafat Varisai Mahamad today refused to unveil the names of three opposition assemblymen whom he claimed to have voiced their support for the state government. ,2023-12-06,Politics
Perak PKR veep keeps mum on three opposition assemblyman supporting Saarani,IPOH: Perak PKR vice-chairman Muhamad Arafat Varisai Mahamad today refused to unveil the names of three opposition assemblymen whom he claimed to have voiced their support for the state government. ,2023-12-06,Politics
No impact on Pas if Umno refuses to cooperate - Tuan Ibrahim,"KOTA BARU: Datuk Seri Tuan Ibrahim Tuan Man said the statements from Umno president, declaring non-cooperation with Pas, will not pose any issue for the Islamic party.",2023-12-06,Politics
'Why should I follow his orders and show my face at his turf?',KUALA LUMPUR: Umno supreme council member Isham Jalil has stood firm in his stance to not attend any meetings carried out by the party as long as it continues to work with DAP. ,2023-12-06,Politics
"Umno Supreme Council meeting to address Kemaman-by election defeat, possible cabinet reshuffle?","KUALA LUMPUR: Umno Supreme Council meeting is set to convene tonight, with sources indicating that the recent defeat in the Kemaman by-election is high on the agenda.",2023-12-06,Politics
Zahid tells Isham Jalil to attend Umno supreme council meeting tonight,PUTRAJAYA: Datuk Seri Dr Ahmad Zahid Hamid has challenged Umno Supreme Council member Isham Jalil to attend the party’s supreme council meeting tonight for the latter to air his grouses on the cooperation between the party and DAP.,2023-12-06,Politics
"No more room for Umno-Pas political cooperation, says Puad Zarkashi",KUALA LUMPUR: An Umno Supreme Council member has poured cold water on a possibility of the party rekindling its political cooperation with Pas.,2023-12-06,Politics
Umno-BN's defeat in Kemaman by-election blamed on alleged deviation and alignment with DAP,KUALA LUMPUR: The loss of Umno-Barisan Nasional in the Kemaman by-election is due to some Umno members who are lackeys of DAP.,2023-12-05,Politics
'The Hulu Kinta assemblyman should not practice cheap politics',IPOH:  Perak PKR vice-chairman Muhamad Arafat Varisai Mahamad has been challenged to reveal the names of three opposition assemblymen who voiced their support for the state government.,2023-12-05,Politics
"PM: Samsuri a moderate leader, unlike 'more extremist' Pas colleagues",PUTRAJAYA: Datuk Seri Anwar Ibrahim hopes that Datuk Seri Dr Ahmad Samsuri Mokhtar’s victory in the Kemaman parliamentary by-election in Terengganu will  cool down the political temperature in the country.,2023-12-05,Politics
Pas sec-gen fires back at DAP advisor: Focus on your own turf,KUALA LUMPUR: Pas secretary-general Datuk Seri Takiyuddin Hassan today said DAP's Tan Sri Lim Kit Siang should focus on his own coalition matters instead of meddling in other people's affairs.,2023-12-05,Politics
Kampar MP lodges report against Sanusi over Buddha statue remarks,"IPOH: Kampar member of Parliament Chong Zhemin today lodged a police report against Kedah Menteri Besar Datuk Seri Muhammad Sanusi Md Noor over his seditious remarks on Tourism, Arts and Culture Minister Datuk Seri Tiong King Sing. ",2023-12-04,Politics
Perak RKR vice chairman claims 3 opposition assemblymen support state govt,IPOH: At least three opposition state assemblymen have allegedly thrown their support for the state government under the leadership of Datuk Seri Saarani Mohamad. ,2023-12-04,Politics
Dr M: Umno will be destroyed in GE16,KUALA LUMPUR: Former prime minister Tun Dr Mahathir Mohamed believes the latest Kemaman by-election result signals the end of Umno in the next 16th General Election (GE16). ,2023-12-04,Politics
Fahmi believes Pas aiming for opposition leader's role,KUALA LUMPUR: Unity government spokesman Fahmi Fadzil believes that Pas is gunning for the opposition leader's role following its victory at the Kemaman by-election.,2023-12-04,Politics
"'I, myself didn't know that I will be doing that (stepping down)' - Zahid",PUTRAJAYA: Deputy Prime Minister Datuk Seri Dr Ahmad Zahid Hamidi has denied rumours that he will be stepping down from his post due to health reasons.,2023-12-04,Politics
'Watch your mouth if you are serious about attracting tourists to Kedah': Tiong to Sanusi,"PUTRAJAYA: Tourism, Arts, and Culture Minister Datuk Seri Tiong King Sing advised Kedah Menteri Besar Datuk Seri Muhammad Sanusi Md Nor to watch his mouth if he is serious about bringing more tourists to visit the state.",2023-12-04,Politics
"Pas victory in Kemaman does not signify rejection towards unity government, says Saifuddin",PUTRAJAYA: The decisive victory of Pas with a large majority in the recent Kemaman by-election last Saturday is not indicative of the people's rejection of the unity government.,2023-12-04,Politics
"Kemaman by-election loss: Decrease in Umno loyal voters, says Zahid","PUTRAJAYA: The Kemaman parliamentary by-election loss by Barisan Nasional (BN) is not attributed to the rise of Pas supporters, BN chairman Datuk Seri Dr Ahmad Zahid Hamidi said today. ",2023-12-04,Politics
Amizar sworn in as Pelangai assemblyman,KUANTAN: Newly-elected Pelangai assemblyman Datuk Amizar Abu Adam took his oath of office at the 15th Pahang State Legislative Assembly sitting here today.,2023-12-04,Politics
Kemaman by-election: Winning in one's own stronghold is not extraordinary - Muhammad Kamil,"KUALA LUMPUR: Terengganu Menteri Besar Datuk Seri Dr Ahmad Samsuri Mokhtar’s success in winning the Kemaman Parliamentary seat,  which is a Pas stronghold, is not extraordinary, said the Political Secretary to the Finance Minister, Muhammad Kamil Abdul Munim.",2023-12-04,Politics
Kemaman by-election: Winning in one's own stronghold is not extraordinary - Muhammad Kamil,"KUALA LUMPUR: Terengganu Menteri Besar Datuk Seri Dr Ahmad Samsuri Mokhtar’s success in winning the Kemaman Parliamentary seat,  which is a Pas stronghold, is not extraordinary, said the Political Secretary to the Finance Minister, Muhammad Kamil Abdul Munim.",2023-12-04,Politics
"Pas now has genuine PM candidate, say analysts","KUALA LUMPUR:  Political analysts believe Pas has finally found   a prime ministerial candidate in the form of Datuk Seri Dr Ahmad Samsuri Mokhtar, who successfully won  by a bigger margin  against the unity government candidate in the Kemaman by-election on Saturday. ",2023-12-04,Politics
Analyst: Pas reused same formula to defeat BN in Kemaman by-election,"KUALA LUMPUR: Pas recycled the same tried and tested formula it used in the 15th General Election (GE15) for the Kemaman by-election held yesterday, resulting in a bigger margin win against Barisan Nasional (BN). ",2023-12-03,Politics
Sabah DAP confident Anwar's leadership will provide greater resources for the state,KOTA KINABALU: Sabah DAP has adopted several motions including to extend full support to the unity government led by Prime Minister Datuk Seri Anwar Ibrahim.    ,2023-12-03,Politics
Umno scrutinises heavy defeat in Kemaman by-election,KUALA LUMPUR: Umno Supreme Council will be scrutinising Barisan Nasional's heavy defeat to Perikatan Nasional in the Kemaman by-election held yesterday. ,2023-12-03,Politics
MA63: Sabah Umno proposes a roundtable secretariat for in-depth discussions on state's 40pct net revenue,"KOTA KINABALU: Sabah Umno has proposed the establishment of a ""Roundtable Secretariat"" for all parties in the state to discuss issues related to the 40 per cent net revenue in the Malaysia Agreement 1963 (MA63).",2023-12-03,Politics
"Unity govt not worried with Pas' victory in Kemaman, says Fahmi Fadzil","KUALA LUMPUR: The unity government is not worried about Pas’ victory in yesterday’s Kemaman parliamentary by-election, said Minister of Communications and Digital Fahmi Fadzil. ",2023-12-03,Politics
Takiyuddin: Kemaman by-election is people's referendum on PH-BN,"KUALA LUMPUR: The outcome of the Kemaman by-election, which saw Terengganu Menteri Besar Datuk Seri Dr Ahmad Samsuri Mokhtar clinching the seat, has confirmed the upward momentum of people's support for Perikatan Nasional. ",2023-12-03,Politics
Fahmi: Govt expects Dr Samsuri as next opposition leader,KUALA LUMPUR: The government anticipates a change in the figure of the opposition leader in parliament following the victory achieved by Datuk Seri Dr Ahmad Samsuri Mokhtar yesterday.,2023-12-03,Politics
Kemaman by-election: Pas' dominant win signals Terengganu voters rejection of opposition rep,"KEMAMAN: Pas' landslide victory in the Kemaman by-election might be perceived as a signal from Terengganu voters rejecting opposition representative in the state, Datuk Seri Dr Ahmad Samsuri Mokhtar said.",2023-12-03,Politics
"Ahmad Samsuri says open to future PM role, to focus on parliamentary responsibilities",KEMAMAN: Newly-elected Kemaman member of parliament Datuk Seri Dr Ahmad Samsuri Mokhtar has expressed a willingness to consider the prospect of becoming Malaysia's prime minister in the future.,2023-12-03,Politics
Ahmad Samsuri thanks voters; Hadi attributes win to people's rejection of unity govt,KUALA LUMPUR: The newly-emerged winner of the Kemaman parliamentary seat by-election Datuk Seri Dr Ahmad Samsuri Mokhtar has thanked those who were involved in the by-election.,2023-12-02,Politics
"Do not be arrogant with your winning, and do not despair when you lose- Asyraf Wajdi",KUALA LUMPUR: Umno secretary-general Datuk Dr Asyraf Wajdi Dusuki has thanked loyal Barisan Nasional (BN) voters for still believing in the coalition's struggle. ,2023-12-02,Politics
"Official results: PN retains Kemaman with 37,220 majority [NSTTV]",KEMAMAN: Perikatan Nasional (PN) continues its dominance in Terengganu after Pas candidate Datuk Seri Dr Ahmad Samsuri Mokhtar won the Kemaman parliamentary seat by-election today.,2023-12-02,Politics
Unofficial results : Pas set for another landslide victory in Kemaman,KEMAMAN: Pas appears to be heading for another whopping majority victory in the Kemaman parliamentary seat by-election today. ,2023-12-02,Politics
Unofficial result: PN's Ahmad Samsuri holds significant lead in Kemaman parliamentary seat battle,KEMAMAN: Unofficial results showed Perikatan Nasional's Datuk Seri Dr Ahmad Samsuri Mokhtar is leading the battle in the Kemaman parliamentary seat by-election.,2023-12-02,Politics
Ampang to Kemaman: Voter's four-hour drive ends in disappointment as polls close,KEMAMAN: A technician who undertook a four-hour journey from Kuala Lumpur to participate in the Kemaman by-election was left disappointed as he missed the opportunity to cast his ballot.,2023-12-02,Politics
"Kemaman by-election: Polling ends at 6pm, vote counting begins","KEMAMAN: Polling for the Kemaman parliamentary seat, which commenced at 8am today, has officially ended, with all 49 polling centres in the constituency closing their doors at 6pm.",2023-12-02,Politics
Kemaman by-election: Voter turnout reaches 60 per cent at 4pm,"KEMAMAN: The voter turnout for the Kemaman parliamentary seat by-election continues to rise, reaching 60 per cent as of 4pm today.",2023-12-02,Politics
Wan Fayhsal: Claims surrounding govt MPs switching camp to PN not true,"KUALA LUMPUR: A Parti Pribumi Bersatu Malaysia (Bersatu) leader has denied claims made by its Supreme Leadership Council member Datuk Seri Mohd Redzuan Md Yusof that 10 members of parliament (MP) from the government bloc are set to switch their support for Perikatan Nasional (PN), subsequently forming a new government.",2023-12-02,Politics
Wan Fayhsal: Claims surrounding govt MPs switching camp to PN not true,"KUALA LUMPUR: A Parti Pribumi Bersatu Malaysia (Bersatu) leader has denied claims made by its Supreme Leadership Council member Datuk Seri Mohd Redzuan Md Yusof that 10 members of parliament (MP) from the government bloc are set to switch their support for Perikatan Nasional (PN), subsequently forming a new government.",2023-12-02,Politics
Kemaman by-election: EC conducting trial run for new digital system,KEMAMAN: The Election Commission(EC) has deployed a new digital method to help improve the country's electoral system in the Kemaman parliamentary seat by-election.,2023-12-02,Politics
BN candidate urges Kemaman voters to cast their ballots tomorrow,CHUKAI: The Barisan Nasional (BN) candidate in the Kemaman parliamentary by-election has asked voters to go out in full force to cast their ballots tomorrow (December 2).,2023-12-01,Politics
Kemaman by-election: Pas in the driver's seat but all eyes on BN's direct candidate,"KEMAMAN: Five years ago, Barisan Nasional pulled off a masterstroke when it named former police officer Datuk Ramli Mohd Nor as the coalition's direct candidate for the Cameron Highlands parliamentary seat by-election.",2023-12-01,Politics
Kemaman by-election: Dr Sam casually stops at BN operations centre in Kemaman,"KEMAMAN: Just hours before the Kemaman parliamentary seat by-election campaigning period ends, Perikatan Nasional candidate Datuk Seri Dr Ahmad Samsuri Mokhtar did what probably no political contender has ever done.",2023-12-01,Politics
Kemaman by-election: BN candidate's schedule packed on final day while PN rep focuses on 'grand finale',KEMAMAN: A lukewarm atmosphere is being felt across the Kemaman parliamentary constituency after two weeks of campaigning which is in its last day today.,2023-12-01,Politics
Kemaman by-election: Pas' Dr Sam 'prime minister' material,"KEMAMAN: Pas, the party with the most number of members of parliament in the Perikatan Nasional (PN) coalition, may have finally found the missing jigsaw piece to steer the party to greater heights.",2023-11-30,Politics
Kemaman by-election: Boost for security matters if ex-Defence Force Chief is in Lower House,CHUKAI: The prospect of a former distinguished military officer being elected to the Lower House offers a valuable opportunity to enhance the legislative arm with expert insights into national security and defence matters.,2023-11-30,Politics
Sanusi: I have no ambition to be the PM [NSTTV],ALOR STAR: Kedah Menteri Besar Datuk Seri Muhammad Sanusi Md Nor said he has never set a target or even dream of becoming the prime minister. ,2023-11-30,Politics
"Political appointees have no business meddling in govt administrative affairs, says Sanusi",ALOR STAR: Datuk Seri Muhammad Sanusi Md Nor has reminded political appointees in the federal government that they have no business meddling in government administrative affairs.,2023-11-30,Politics
Kemaman by-election: Terengganu needs an opposition elected rep or Pas will become superior,"KEMAMAN: Although Pas appears to be the clear favourite to retain the Kemaman parliamentary seat in Saturday’s by-election here, some voters are not in favour of allowing the party to have complete dominance across Terengganu.",2023-11-30,Politics
Kemaman by-election: Constituency will be govt's 'golden child' if BN's candidate secures victory- Shabery Cheek,KEMAMAN: The Kemaman parliamentary constituency will become the unity government's “golden child” if the voters here are daring enough to make changes on Dec 2.,2023-11-30,Politics
"'Follow the rules when you are in my House,' says Speaker Johari [NSTTV]",KUALA LUMPUR: Dewan Rakyat Speaker Tan Sri Johari Abdul today warned both government and opposition lawmakers to follow the House rules and submit a motion if they are unsatisfied with answers provided by ministries during question time. ,2023-11-30,Politics
