0,1,2,3
Three PH reps will represent voices of all races in Kedah state assembly,ALOR STAR: Kota Darul Aman assemblyman Teh Swee Leong has vowed to represent the voice of all Kedahans including the Malays in the state legislative assembly.,2023-08-22,Politics
Zahid: MPs vacating seats are just rumors,SHAH ALAM: Umno president Datuk Seri Dr Ahmad Zahid Hamidi dismissed claims made by his own party supreme council member about seven Barisan Nasional (BN) member of Parliament contemplating to vacate their seats. ,2023-08-21,Politics
"BN will work to regain the trust and support of the people, chairman Zahid Hamidi says [NSTTV]","KUALA LUMPUR: Acknowledging that Barisan Nasional (BN) is facing rejection from the people, Datuk Seri Dr Ahmad Zahid Hamidi said BN has to take a more aggressive stance in quickly restoring the people’s confidence through its coalition of parties.",2023-08-21,Politics
"No issue over Kedah exco members appointment, insists Bersatu man",ALOR STAR: Kedah Bersatu Information chief Khairul Anuar Ramli has brushed off claims that the party had objected to the state executive council members line up.,2023-08-21,Politics
Amirudin says MB swearing-in delay to allow Sultan to rest after London surgery,"KLANG: With the Selangor Menteri Besar swearing-in ceremony done and dusted, Datuk Seri Amirudin Shari hoped there will be no more speculations on the purported delay of his appointment. ",2023-08-21,Politics
Three first time assemblymen made Sgor excos,KLANG: Three first time Selangor state assemblymen from Pakatan Harapan (PH) have been made executive councillors. ,2023-08-21,Politics
Three first time assemblymen made Sgor excos,KLANG: Three first time Selangor state assemblymen from Pakatan Harapan (PH) have been made executive councillors. ,2023-08-21,Politics
Umno to compile post-mortem findings on party's poor performance during state polls - Khaled,BANGI: Umno is set to gather all their state and wing-level post-mortem findings on the party's poor performance in the recent state elections. ,2023-08-21,Politics
Pahang EC receives notice of vacant Pelangai state seat,"KUANTAN: The Pahang Election Commission (EC) has received official notification of the vacancy of the Pelangai state seat following the death of its assemblyman, Datuk Seri Johari Harun, in an aircraft crash on Aug 17.",2023-08-21,Politics
"Ex-UUM VC, ex-football ace among 10 sworn in as Kedah exco members",ALOR STAR: Former University Utara Malaysia (UUM) vice chancellor Dr Haim Hilman Abdullah and former Kedah football ace Mohd Radhi Mat Din are among 10 assemblymen who were sworn in as Kedah state executive councillors today.,2023-08-21,Politics
Bersatu unhappy with three seat allocation in Pas-led Kedah exco line up,"ALOR STAR: Tension is brewing within Kedah Perikatan Nasional (PN) ahead of the swearing-in ceremony of the state executive councillors, which is scheduled to take place at Istana Anak Bukit here tomorrow morning.",2023-08-20,Politics
Pulai by-election: Suhaizan wants to win with a convincing majority,JOHOR BARU: Former Johor State Assembly Speaker Suhaizan Kaiat wants to score a convincing win for Pakatan Harapan (PH) in the Pulai parliamentary by-election next month.,2023-08-20,Politics
"Govt should declassify Ambalat block agreement, says Sabah PN",KOTA KINABALU: The government should promptly declassify the maritime boundary agreement related to the Ambalat block in the Sulawesi Sea. ,2023-08-20,Politics
MCA gives freedom for Sabah leaders to pursue MA63 and state rights,KOTA KINABALU: Malayan Chinese Association has no issue to let its Sabah counterpart to pursue rights according to the Malaysia Agreement 1963 (MA63).  ,2023-08-20,Politics
PN ready to face any narrative thrown against the party,"MUAR: Perikatan Nasional (PN), particularly Pas, is ready to face any narrative thrown against the party including fear-mongering of the ‘green wave’ towards the non-Malay voters during the Johor by-election. ",2023-08-20,Politics
Call for Umno leadership to engage with Youth wing and grassroots,ALOR STAR: Umno leaders have been urged to engage with the Youth wing and grassroots following the party's lacklustre performance in the recent state elections.,2023-08-20,Politics
"PKR Youth slams PN over different logo, theme for National Day",KUALA LUMPUR: Perikatan Nasional (PN) must stop the prolonged confrontation between the states it rules against the federal administration. ,2023-08-20,Politics
Two Kelantan assemblymen demand public apology from Kelantan MB,KOTA BARU: Two assemblymen from Barisan Nasional (BN) and Amanah today demanded for a public apology from Kelantan Menteri Besar Datuk Nassuruddin Daud for calling them opponents to the Islamic struggle.,2023-08-20,Politics
Zahid slams PN's Ahmad Fadhli over different National Day logo plan,PUTRAJAYA: Deputy Prime Minister Datuk Seri Dr Ahmad Zahid Hamidi has described Perikatan Nasional's (PN) plan to use different National Day logos and themes in the four states under its administration as crazy.,2023-08-20,Politics
'Umno must take collective responsibility',KUALA LUMPUR:   Umno Youth chief Dr Muhammad Akmal Saleh’s recent statements against the party leadership should be seen positively as it was a call for the party to move forward after its state polls defeat.,2023-08-20,Politics
"Green Wave is a Malay-Muslim resurgence, not a threat, says MP","JOHOR BARU: Do not demonise the “Green Wave” as threatening the nation’s stability; instead, regard it as a Malay-Muslim resurgence.",2023-08-19,Politics
Johor Bersatu chief decodes `green wave' as public revolt against Klepto leaders,"KULAI: What has been hailed as Perikatan Nasional (PN)'s ""green wave"" holds a more profound meaning, signifying a collective rejection of leaders entangled in kleptocracy.",2023-08-19,Politics
"'Find the fault, not who is at fault', says Puad","KUALA LUMPUR: There is no need for Umno members to relinquish their position following the party’s disastrous performance in the six state elections, said Supreme Council Member Datuk Dr Mohd Puad Zarkashi.   ",2023-08-19,Politics
Nur Jazlan: Some desperate Umno MPs willing to resign to trigger by-election,JOHOR BARU: Desperate politicians will resort to anything to satisfy their thirst for power regardless if its impact on the nation’s political stability.,2023-08-19,Politics
Malay voter exodus: Umno's core support dwindles to 27 per cent in recent state elections,"KUALA LUMPUR:  Umno had recorded the worst performance, losing core voters, with an estimation that only 27 per cent of the Malay voters voted for the Barisan Nasional (BN)- Pakatan Harapan (PH) coalition in the recent state elections.",2023-08-19,Politics
"Johor DAP committee member steps down, party charts new course","JOHOR BARU: In a recent development, Tan Chen Choon, a Johor State DAP committee member, tender his resignation on Wednesday (Aug 16).",2023-08-19,Politics
"Johor DAP committee member steps down, party charts new course","JOHOR BARU: In a recent development, Tan Chen Choon, a Johor State DAP committee member, tender his resignation on Wednesday (Aug 16).",2023-08-19,Politics
"Ismail Sabri says Umno's defeat in state polls was due to party straying from struggles, rejecting of  Muafakat Nasional",KUALA LUMPUR: Former prime minister Datuk Seri Ismail Sabri Yaakob said Umno’s defeat in the Aug 12 state elections stemmed from the party straying from its original struggles of championing the interest of the Malays.,2023-08-19,Politics
"Muhyiddin to announce PN candidates for Pulai, Simpang Jeram polls next week",KULAI:  Perikatan Nasional (PN) chairman Tan Sri Muhyiddin Yassin is expected to announce the coalition’s candidates for the Pulai parliamentary and Simpang Jeram state by-elections next week.,2023-08-19,Politics
"Ahmad: BN, PH must stop 'green wave' influences in Johor ahead of by-elections",PONTIAN: Barisan Nasional (BN) and Pakatan Harapan (PH) must work harder to thwart Perikatan Nasional (PN)’s “Green Wave” sentiments before it becomes a threat in the upcoming Pulai and Simpang Jeram by-elections on Sept 9.,2023-08-19,Politics
Umno Youth should channel frustrations over party polls to Supreme Council,IPOH: Umno Youth should channel their views and frustrations over the party’s result in the six-state elections through the right channel.   ,2023-08-19,Politics
Continue working as usual while awaiting state polls post-mortem result - Fahmi,KUALA LUMPUR: Pakatan Harapan (PH) Communications Director Fahmi Fadzil has urged all parties within the unity government to be patient and continue working as usual while awaiting the result of the post-mortem of the recent elections in six states.,2023-08-19,Politics
"Amanah names Suhaizan, Nazri candidates for Pulai, Simpang Jeram","JOHOR BARU: Former Johor State Legislative Assembly Speaker Suhaizan Kaiat and Nazri Abdul Rahman have been named Pakatan Harapan (PH) candidates for the Pulai parliamentary and Simpang Jeram state by-elections, respectively.",2023-08-19,Politics
Sabah Umno prefers to work with parties that honour mutual agreements,"KOTA KINABALU: Sabah Umno will only collaborate with parties that respect mutual agreements, said its chairman Datuk Seri Bung Moktar Radin. ",2023-08-18,Politics
Selangor's exco seat allocations trigger debates,"SHAH ALAM: The Selangor Pakatan Harapan (PH) has reportedly reached an accord on the seat allocations for its 10-member executive council, with Barisan Nasional set to be represented in the lineup.",2023-08-18,Politics
"PH to announce candidates for Pulai, Simpang Jeram polls on Wednesday",JOHOR BARU: Pakatan Harapan (PH) will announce its candidates for the Pulai parliamentary and Simpang Jeram state by-elections on August 23.,2023-08-18,Politics
PH-BN can retain Pulai parliamentary and Simpang Jeram state seats in coming by-elections,PONTIAN:  The Pakatan Harapan (PH) and Barisan Nasional (BN) pact is seen as being capable of retaining their Pulai parliamentary and the Simpang Jeram state assembly seats in the upcoming by-elections on Sept 9.,2023-08-17,Politics
This is Umno's last chance to redeem itself - Isham Jalil,"KUALA LUMPUR: Now is the time for Umno to listen to the grassroots and redeem itself, says Supreme Council member Isham Jalil.",2023-08-17,Politics
Anwar: No issues working with PN governed states,"KUALA LUMPUR: Prime Minister Datuk Seri Anwar Ibrahim is willing to work closely with the state governments of Kedah, Terengganu and Kelantan, which are helmed by the opposition.  ",2023-08-17,Politics
New Penang Exco line-up reflects political maturity,"GEORGE TOWN:  The new line-up of the Penang state executive council members reflects the new political maturity for the prosperity and unity of the people, said Batu Maung assemblyman, Datuk Dr Mohamad Abdul Hamid.",2023-08-16,Politics
Reezal and me support each other,GEORGE TOWN: Newly-elected Sungai Acheh assemblyman Rashidi Zinol says he receives the support of Datuk Seri Reezal Merican Naina Merican as Barisan Nasional’s sole state executive council member from the unity government for the state. ,2023-08-16,Politics
Pas welcomes court's decision to strike out case against Muhyiddin,KOTA BARU: Pas has expressed it  gratitude and welcomed the decision made by the Kuala Lumpur High Court yesterday to strike out the abuse of power case against Perikatan Nasional (PN) chairman Tan Sri Muhyiddin Yassin.,2023-08-16,Politics
First day of duty for Kelantan's newest MB [NSTTV],KOTA BARU: Newly sworn-in Datuk Mohd Nassuruddin Daud officially clocked in for duty today.,2023-08-16,Politics
PN rejects call for unity govt peace deal [NSTTV],"The “sought-after stability”, it said, should not suppress reforms, including a change of leadership that failed to serve the nation’s best interests.",2023-08-16,Politics
"Claim that Amirudin may not being appointed Selangor MB not true, says press sec",KUALA LUMPUR: Speculation that Datuk Seri Amirudin Shari will not be appointed Selangor Menteri Besar for the second term is untrue.,2023-08-15,Politics
Analysts: Legislative Assembly shouldn't be left without an opposition,"KUALA TERENGGANU: For the first time in history, Terengganu will not have an opposition in the state assembly, with Perikatan Nasional (PN) sweeping all 32 seats in the recent state election.",2023-08-15,Politics
Analysts: Legislative Assembly shouldn't be left without an opposition,"KUALA TERENGGANU: For the first time in history, Terengganu will not have an opposition in the state assembly, with Perikatan Nasional (PN) sweeping all 32 seats in the recent state election.",2023-08-15,Politics
Sanusi to present Exco line up to the Sultan of Kedah on Thursday,ALOR SETAR: Menteri Besar Datuk Seri Muhammad Sanusi Md Nor will have an audience with the Sultan of Kedah Al-Aminul Karim Sultan Sallehuddin Sultan Badlishah at Istana Anak Bukit here on Thursday (August 17) to present his proposed list of state executive councillors. ,2023-08-15,Politics
Johor PH sets up main committee to face Sept 9 by-elections,JOHOR BARU: Johor Pakatan Harapan (PH) has set up an election main committee for the Pulai and Simpang Jeram by-elections next month.,2023-08-15,Politics
Aminuddin: N.Sembilan may rename Exco portfolios to align with Federal Gov't," SEREMBAN: The Negri Sembilan government may rename the state executive council portfolios to align them with the federal ministerial designations, said Menteri Besar Datuk Seri Aminuddin Harun.",2023-08-15,Politics
Analysts: Umno should bring back 'reformist minded' individuals,KUALA LUMPUR: Political analysts believe that Datuk Seri Ahmad Zahid Hamidi’s removal as party president will not bring much difference to Umno’s reformation if there are no “reformist minded” individuals who want to overhaul the party’s direction.,2023-08-15,Politics
"Analysts: Practical to hold State, General Elections simultaneously","KUALA LUMPUR: The proposal for the state and general elections to be held simultaneously is practical as it can have a positive impact on voter turnout, according to experts.",2023-08-15,Politics
"PN shortlists 15 names as possible candidates for Simpang Jeram, Pulai polls",JOHOR BARU: Perikatan Nasional (PN) has shortlisted 15 names to be considered as the two candidates who will be representing the coalition in the Pulai parliamentary and Simpang Jeram by-elections on September 9.,2023-08-15,Politics
"Speculations on new Kelantan MB and deputy over, Kelantan Palace confirms appointees",KOTA BARU: Speculations on who will become the new Kelantan menteri besar and deputy menteri besar finally ended today after confirmation from the Kelantan State Palace on who will be sworn-in for the top posts. ,2023-08-15,Politics
Nur Jazlan: Blaming Zahid alone does not address Umno's core issues,JOHOR BARU: Umno leaders and grassroots members are cautioned against making the party president the scapegoat for the party's dismal performance in the recently-concluded state elections on Aug 12.,2023-08-15,Politics
No party can prevent other political parties from contesting in Sabah polls - Kiandee,KOTA KINABALU: Parti Pribumi Bersatu Malaysia vice-president Datuk Seri Dr Ronald Kiandee is demanding an explanation on a proposal that only local political parties should contest in the next Sabah election.,2023-08-15,Politics
Zahid Hamidi is aware of calls for him to step down,KUALA LUMPUR: Barisan Nasional (BN) chairman Datuk Seri Dr Ahmad Zahid Hamidi is aware of the pressure from various quarters who want him to step down following the BN’s performance in the state elections last Saturday.,2023-08-15,Politics
PH-BN partnership not the main reason why voters chose PN: Loke,SEREMBAN: The partnership between Pakatan Harapan (PH) and Barisan Nasional (BN) in forming the unity government was not the main reason why voters rejected the coalition in the recently concluded state elections.,2023-08-15,Politics
"Sept 9 by-elections: Johor PH formulating strategies with BN, says Aminolhuda","JOHOR BARU: Johor Parti Amanah Negara is in discussions with its Pakatan Harapan (PH) partner, Barisan Nasional (BN), about the upcoming by-elections for the Pulai parliamentary and Simpang Jeram state seats.",2023-08-15,Politics
"Unity government needs strategy to oppose ethnic, religious narrative: Ramasamy",GEORGE TOWN: The unity government needs a counter hegemonic strategy to oppose the ethnic and religious narrative and wean back the much needed Malay support back to them.,2023-08-15,Politics
"BN to be given a seat in Penang govt, says DAP [NSTTV]","KUALA LUMPUR: A Barisan Nasional (BN) state assemblyman will be given a state executive council (exco) member position in the Penang state assembly, said the Democratic Action Party (DAP) secretary-general Anthony Loke Siew Fook. ",2023-08-14,Politics
"DAP has no plans to merge with other party, says Anthony Loke","KUALA LUMPUR: The Democratic Action Party (DAP) has no plan to merge with other political parties, but will instead focus on beefing itself up, says DAP secretary-general Anthony Loke Siew Fook. ",2023-08-14,Politics
Pas may file petition against results of state elections,KOTA BARU: Pas has not ruled out the possibility of filling an election petition against the results of Saturday's state elections. ,2023-08-14,Politics
GRS contesting all 73 state seats merely SAPP personal opinion - Nizam,KOTA KINABALU: Gabungan Rakyat Sabah (GRS) today cleared the air over talks that the coalition was to contest all state seats in the upcoming elections. ,2023-08-14,Politics
PN will monitor performance of its representatives who won state elections,KOTA BARU: Perikatan Nasional (PN) will constantly monitor the performance of its candidates who won Saturday's elections in six states.,2023-08-14,Politics
"Pulai, Simpang Jeram by-elections : Johor Amanah to submit list of candidates tomorrow",BATU PAHAT: Johor Parti Amanah Negara (Amanah) will be handing in a full list of candidates contesting in the Pulai parliamentary and Simpang Jeram state by-elections scheduled for next month to the central leadership tomorrow (August 15).,2023-08-14,Politics
"Pulai, Simpang Jeram by-elections : Johor Amanah to submit list of candidates tomorrow",BATU PAHAT: Johor Parti Amanah Negara (Amanah) will be handing in a full list of candidates contesting in the Pulai parliamentary and Simpang Jeram state by-elections scheduled for next month to the central leadership tomorrow (August 15).,2023-08-14,Politics
"Only Hajiji's words carry weight on Sabah's 73-seat distribution for election, says DAP",KOTA KINABALU: Only Gabungan Rakyat Sabah (GRS) chairman Datuk Seri Hajiji Noor can decide  on the political formula that will be used by the state coalition in the next state election.,2023-08-14,Politics
PH should shoulder some blame for BN's dismal outing - Analyst,KUALA LUMPUR: Pakatan Harapan (PH) should share the responsibility for Barisan Nasional’s (BN) dismal performance in Saturday’s six state elections. ,2023-08-14,Politics
Aminuddin sworn in as Negri Sembilan MB for third term,KUALA PILAH: State Pakatan Harapan (PH) chairman Datuk Seri Aminuddin Harun was sworn in as the Negri Sembilan menteri besar for a third term today.,2023-08-14,Politics
PKR dismisses claim of Reezal Merican becoming Penang DCM,GEORGE TOWN: A number of posters proclaiming that a Barisan Nasional politician has been appointed to the Penang deputy chief minister post have made its rounds on social media.,2023-08-14,Politics
Sanusi: Racial polarisation also exists in seats won by PH [NSTTV],"ALOR STAR: Perikatan Nasional (PN)  election director Datuk Seri Muhammad Sanusi Md Nor said the trend of racial polarisation was expected, as political parties in the county were formed based on ethnic lines.",2023-08-14,Politics
"PN's political ideologies bad for country, Islam and Malays: Khalid Samad","KOTA BARU: Perikatan Nasional’s (PN) political ideologies are detrimental to the country, Islam and Malays, says Parti Amanah Negara (Amanah). ",2023-08-14,Politics
Amanah hopes Chow will give them exco seat,GEORGE TOWN: Parti Amanah Negara (Amanah) hopes Chief Minister Chow Kon Yeow will consider giving the party a state executive council member (exco) post in the new exco line-up.,2023-08-14,Politics
'Gerakan win in Kulim shows unity within PN',ALOR STAR: Gerakan’s victory in Kulim in Saturday’s state election is proof Perikatan Nasional has always respected its coalition partner.,2023-08-14,Politics
Sole BN assemblyman in Kelantan pledges to continue services to Orang Asli,"GUA MUSANG: The sole Barisan Nasional assemblyman in Kelantan pledges to serve his voters well, especially the more than 7,000 Orang Asli voters in his constituency.",2023-08-14,Politics
'Muhyiddin was arrogant when he told Zahid to resign',KUALA LUMPUR: Umno supreme council member Datuk Dr Mohd Puad Zarkashi labelled Perikatan Nasional (PN) chairman Tan Sri Muhyiddin Yasin as arrogant for calling for Barisan Nasional (BN) chairman Datuk Seri Dr Ahmad Zahid Hamidi to resign. ,2023-08-14,Politics
Umno's loss in Kelantan is a starting point for its success in GE16: Zawawi,KOTA BARU: Umno has accepted its defeat in Kelantan in Saturday's state election but believes this will be a start for the party to succeed in the 16th General Election (GE16).,2023-08-14,Politics
"PN assemblymen clean and stable, Sanusi gives assurance",ALOR STAR: Kedah Menteri Besar Datuk Seri Muhammad Sanusi Md Nor has given his assurance that every member of the State Legislative Assembly under his leadership will remain free from corruption or misconduct.,2023-08-14,Politics
Johari: Muhyiddin shouldn't gloat,"KUALA LUMPUR: Umno vice-president Datuk Seri Johari Abdul Ghani yesterday chided Tan Sri Muhyiddin Yassin for claiming that Parti Pribumi Bersatu Malaysia, not Umno, now represents the voice of the Malays.",2023-08-14,Politics
Chow clocks in for duty,"GEORGE TOWN: Chief Minister Chow Kon Yeow, who was sworn-in for the second term yesterday, officially clocked in for duty today.",2023-08-14,Politics
"Pas will meet Terengganu Sultan to propose MB candidate today, says Samsuri",KOTA BARU: Pas’s top leaders are expected to meet sultan of Terengganu Sultan Mizan Zainal Abidin Sultan Mahmud Al-Muktafi Billah Shah today to propose a candidate for the menteri besar post.,2023-08-14,Politics
Sanusi sworn in as Kedah MB for second term,ALOR STAR: Kedah Perikatan Nasional chairman Datuk Seri Muhammad Sanusi Md Nor has been sworn-in as the state’s 14th Menteri Besar for the second term at Istana Anak Bukit here today.,2023-08-14,Politics
"Sanusi apologises for words uttered during polls campaign, reminds supporters against mocking defeated opponents",ALOR STAR: Caretaker Kedah Menteri Besar Datuk Seri Muhammad Sanusi Md Nor has extended apologies to anyone who felt offended by Perikatan Nasional during the two-week election campaign for the state election that concluded on Saturday.,2023-08-14,Politics
'Absence of opposition in Terengganu could lead to complacency',KUALA LUMPUR:    Barisan Nasional has been bleeding support in   the last two  elections in  Terengganu    as Pas built on its gains. ,2023-08-14,Politics
State elections: Attacks boosted Sanusi's profile,"ALOR STAR:  The relentless attacks on caretaker Kedah Menteri Besar Datuk Seri Muhammad Sanusi Md Nor may have played a role in developing a “siege mentality” among Kedahans in the state election, leading to Perikatan Nasional’s (PN) victory.",2023-08-14,Politics
State elections: Attacks boosted Sanusi's profile,"ALOR STAR:  The relentless attacks on caretaker Kedah Menteri Besar Datuk Seri Muhammad Sanusi Md Nor may have played a role in developing a “siege mentality” among Kedahans in the state election, leading to Perikatan Nasional’s (PN) victory.",2023-08-14,Politics
State elections: Alarm bells in Penang,"GEORGE TOWN:  The Pakatan Harapan-Barisan Nasional alliance has formed the Penang government with a two-thirds majority, but the results of Saturday’s state election  have set off alarm bells.",2023-08-14,Politics
"Losses, slim wins in Negri should give unity govt parties pause for thought",SEREMBAN:  Pakatan Harapan and Barisan Nasional survived the onslaught of the  “green wave” unleashed by Perikatan Nasional  when parties in the unity government won all but five constituencies in the Negri Sembilan  election.,2023-08-14,Politics
"'PN inroads in S'gor due to distrust among BN, PH supporters'","KUALA LUMPUR:     The   state election saw Perikatan Nasional (PN) making inroads in Selangor, despite  Pakatan Harapan retaining control of the wealthiest state in Malaysia.",2023-08-14,Politics
Analysts: 'Polls show racial divide deepening',KUALA LUMPUR:  The outcome of Saturday’s  state elections  suggests deepening racial polarities in  the country.,2023-08-14,Politics
"Mohd Nassuruddin and Dr Fadzli, new Kelantan MB and Deputy MB combo?",KOTA BARU: Who will be the next Kelantan menteri besar and deputy menteri besar will only be known on Tuesday.,2023-08-14,Politics
MB post: Pas to submit two names to Kelantan Sultan,KOTA BARU: Pas has confirmed it will submit two names of its Menteri Besar candidates to the Sultan of Kelantan for his consent tomorrow.,2023-08-14,Politics
Pas holds meeting to discuss MB post,KOTA BARU: Pas held a meeting at the Menteri Besar's official residence here to discuss the list of candidates for the Menteri Besar post. ,2023-08-13,Politics
Kelantan low voter turnout: PN leaders to conduct thorough post-mortem,KOTA BARU: The low voter turnout recorded in Kelantan state election yesterday raised concerns among Perikatan Nasional leaders at the national level. ,2023-08-13,Politics
