0,1,2,3
PM prays for smooth early voting process [Watch],KUALA LUMPUR: Prime Minister Datuk Seri Anwar Ibrahim has wished all early voters for the state elections well.,2023-08-08,Politics
"Azmin was a good MB 'in certain aspects', says Amirudin","KUALA LUMPUR: Datuk Seri Amirudin Shari said his predecessor Datuk Seri Mohamed Azmin Ali was a good administrator ""in certain aspects"", when the latter held the post five years ago.",2023-08-08,Politics
"Azmin was a good MB 'in certain aspects', says Amirudin","KUALA LUMPUR: Datuk Seri Amirudin Shari said his predecessor Datuk Seri Mohamed Azmin Ali was a good administrator ""in certain aspects"", when the latter held the post five years ago.",2023-08-08,Politics
Gobind: PN fears DAP-Umno cooperation,"PETALING JAYA: Perikatan Nasional (PN) is scared of the solid political cooperation between DAP and Umno at the federal level, said Pakatan Harapan (PH) national deputy chairman Gobind Singh Deo. ",2023-08-07,Politics
Muhyiddin: State polls are a referendum to overthrow unity government [NSTTV],KUALA NERUS: Perikatan Nasional (PN) chairman Tan Sri Muhyiddin Yassin considers the state election a referendum to overthrow the unity government.,2023-08-07,Politics
"Opposition leaders only care about themselves not the people, says PM",TANAH MERAH: Opposition leaders only care about themselves and do not care about the people’s wellbeing.,2023-08-07,Politics
"Muda candidate wants to redesign Dusun Tua, fix unresolved local issues",HULU LANGAT: Election newcomer Al Hafiz Ikhwan Mohamad Asaad is determined to fix the unresolved local issues and transform Dusun Tua.,2023-08-07,Politics
Sanusi says road safety was reason he was a no-show at two PN rallies,SIK: Datuk Seri Muhammad Sanusi Md Nor denied that he was advised against attending Perikatan Nasional (PN) rallies in Kedah for two days in a row due to safety reasons.,2023-08-07,Politics
"Selangor and federal govt must be one to ensure smooth flow of future plans, says Gobind",HULU SELANGOR: Selangor has to maintain its administration under Pakatan Harapan to be aligned with the federal government to ensure future plans for the state and its people proceed smoothly.,2023-08-07,Politics
"Govt will bring investors to Kelantan if BN captures state, vows Zahid",TANAH MERAH: The government will bring both locals and foreign investors to Kelantan if Barisan Nasional (BN) is given the mandate to rule the state in the Aug 12 state election.,2023-08-07,Politics
Terengganu's Chinese community wants to see change,"CHUKAI:  It is common knowledge that the political interests of the Chinese community in Terengganu today revolve around the three main cores of economy, education and heritage, and if those three aspects are met, their votes in this state will surely be captured.",2023-08-07,Politics
Two independent candidates in Langkawi reject Pas call to withdraw from race,LANGKAWI: Former Langkawi Pas division chief Mazlan Ahmad and its former Youth wing leader Safwan Hanif Shafie have insisted that they will not withdraw from contesting in the Kuah and Ayer Hangat state seats as independent candidates.,2023-08-07,Politics
Loke: I'm not a DAP PM or Negri Sembilan MB aspirant,HULU SELANGOR: DAP secretary-general Anthony Loke wants his rivals to stop spreading scare tactics of him being prime minister or Negri Sembilan menteri besar amidst a so-called erosion of Malay political powers.,2023-08-07,Politics
"Sanusi releases report on REE theft, takes a swipe at Saifuddin, Rafizi",ALOR STAR: Caretaker Menteri Besar Datuk Seri Muhammad Sanusi Md Nor took a swipe at Home Minister Datuk Seri Saifuddin Nasution Ismail and Economic Minister Rafizi Ramli over the issue of rare earth elements (REE) mineral theft in Sik district.,2023-08-07,Politics
"EC issues 103,197 postal ballot papers for state elections, Kuala Terengganu by-election","KUALA LUMPUR: The Election Commission (EC) has issued a total of 103,197 postal ballot papers to eligible voters for the six state elections and the Kuala Terengganu parliamentary by-election.",2023-08-07,Politics
BN will closely monitor performance of new Kelantan govt and assemblymen if it wins state elections: Zahid,TANAH MERAH: Deputy Prime Minister Datuk Dr Ahmad Zahid Hamidi today said he will closely monitor the performance of the new government in Kelantan if Barisan Nasional (BN) is given the mandate to govern the state after Aug 12.,2023-08-07,Politics
Do you really miss Umno that much? Azalina asks Bersatu's Hamzah,ALOR STAR: Datuk Seri Azalina Othman Said has asked whether Datuk Seri Hamzah Zainudin misses his former party so badly that he could be so concerned about Umno.,2023-08-07,Politics
"Why silent on quota issue, MCA asks DAP ",KUALA LUMPUR: MCA has questioned DAP's silence on the recent quota issue addressed by Prime Minister Datuk Seri Anwar Ibrahim in Penang. ,2023-08-07,Politics
"PN can dream on about changing Putrajaya, says DPM",TANAH MERAH: Deputy Prime Minister Datuk Seri Dr Ahmad Zahid Hamidi said Perikatan Nasional (PN) is dreaming when it stated that there will be a change in the federal government if the coalition wins all six states in the state elections.,2023-08-07,Politics
"Penang PN offers 33 promises in its manifesto, focusing on driving economy and cost of living","KEPALA BATAS: Penang Perikatan Nasional (PN) has unveiled its manifesto for the state election today, involving eight main thrusts and 33 offers.",2023-08-07,Politics
"BN has received MB candidate's list from Kelantan, says DPM",TANAH MERAH: Datuk Seri Dr Ahmad Zahid Hamidi today confirmed that the party has received a list of potential candidates for the Kelantan Menteri Besar's post if Barisan Nasional won in the Aug 12 state election.,2023-08-07,Politics
"Hisham Suhaily Othman: 'Hello I am a real, genuine woman ok'","LANGKAWI: The Barisan Nasional (BN) candidate for  Ayer Hangat here not only has to convince voters here that she is their ideal candidate, but also that she is a real woman.",2023-08-07,Politics
"Hisham Suhaily Othman: 'Hello I am a real, genuine woman ok'","LANGKAWI: The Barisan Nasional (BN) candidate for  Ayer Hangat here not only has to convince voters here that she is their ideal candidate, but also that she is a real woman.",2023-08-07,Politics
Allowing allocations only if state and federal govts are controlled by same party violates democracy and rights,KUALA LUMPUR: Setting a stipulation that allocations be funnelled only if both the state and federal governments are controlled by the same party is a clear breach of democracy and a deprivation of rights.,2023-08-07,Politics
Anwar expected to make final push in Kedah on eve of polling day,ALOR STAR:  Prime Minister Datuk Seri Anwar Ibrahim is expected to tour Kedah in the grand finale of state election campaigning as Pakatan Harapan and Barisan Nasional gain momentum in their campaign to wrest the state from Perikatan Nasional. ,2023-08-07,Politics
"Best for N.Sembilan to be led by same parties in federal unity government, says Tok Mat",SEREMBAN: The Barisan Nasional (BN) and Pakatan Harapan (PH) unity government at the federal level will remain intact irrespective of the outcome of the state election involving Negri Sembilan and five other states in the country.,2023-08-07,Politics
PH-BN lures voters with free parking in all districts in Kelantan,KOTA BARU: The Kelantan Pakatan Harapan-Barisan Nasional (PH-BN)’s offer of free parking in all districts of the state is set to sway voters in favour of its candidate in the polls on Saturday.,2023-08-07,Politics
Juwariya unveils six-pronged 'Agenda Hulu Kelang'  for constituency,"KUALA LUMPUR: In the race towards the finish line, Pakatan Harapan’s Hulu Klang candidate Juwairiya Zulkifli has laid out her six-pronged plan for the constituency. ",2023-08-07,Politics
Saifuddin: Sanusi has resorted to seeking sympathy votes over 'arrest' claims,"ALOR STAR: PKR secretary-general Datuk Seri Saifuddin Nasution Ismail said caretaker Menteri Besar Datuk Seri Muhammad Sanusi Md Nor has now resorted to soliciting sympathy votes over ""arrest"" claims.",2023-08-07,Politics
Dr Muhammad Faiz Na'aman calls it quits from Bersatu,"KUALA LUMPUR: Dr Muhammad Faiz Na’aman has quit from Parti Pribumi Bersatu Malaysia (Bersatu), relinquishing his position as a Supreme Council member. ",2023-08-07,Politics
Ahmad Faizal dismisses claims of sale of seats for the polls,"SEREMBAN: State Perikatan Nasional (PN) chairman Datuk Seri Ahmad Faizal Azumu refuted claims suggesting that he was involved in the ""sale of seats"" within the coalition in the state elections. ",2023-08-07,Politics
"Change in federal government if PN wins all six states in the polls, Pas president claims [NSTTV]",SEREMBAN: Pas president Tan Sri Abdul Hadi Awang claims there will be a change in the federal government if the Perikatan Nasional (PN) win all six states in the state election. ,2023-08-07,Politics
"Withdraw and you won't be expelled, Pas tells two Langkawi independent candidates",LANGKAWI: Pas will not expel its two members who are standing as independent candidates should they withdraw from the state election race in Ayer Hangat and Kuah seats here.,2023-08-07,Politics
"Prioritise economic well-being instead of popular leaders, says Mahdzir",ALOR STAR: Voters in Kedah have been urged to make a wise decision in the Aug 12 state polls by choosing leaders who are capable of effectively managing the state and not voting based on social media popularity. ,2023-08-07,Politics
Ahmad Zahid: Selangor will lose out if it isn't under unity gov't after state election,"KUALA SELANGOR: Selangor, arguably the country’s economic powerhouse that contributed 25.5 per cent of last year’s Gross Domestic Product (GDP), stands to lose out if it does not remain under the Unity Government’s administration after state elections take place on August 12.",2023-08-07,Politics
Can PN honour Negri pledges?,"They question how PN would financially implement the prom-ises  in the  election manifesto for Negri Sembilan, though the pledges look convincing in stimulating  economic growth and addressing people’s  issues",2023-08-07,Politics
Shifting tides for PN in Kedah?,"KUALA LUMPUR: By all accounts, victory for Perikatan Nasional (PN) in the Kedah  state election is supposed to be a walk in the park.",2023-08-07,Politics
Sanusi skips rally for two days in a row due to 'security reasons',SUNGAI PETANI: Caretaker Menteri Besar Datuk Seri Muhammad Sanusi has skipped a Perikatan Nasional rally for a second day in a row due to ‘security reasons’.,2023-08-07,Politics
Anwar: Azmin had thought he could be DPM [NSTTV],HULU KELANG: Prime Minister Datuk Seri Anwar Ibrahim has called upon voters to reject traitors who are trying to win over voters in the state elections.,2023-08-07,Politics
"Polls: No problems retaining Penang, NS and Selangor - Rafizi","TASEK GELUGOR:– Unity Government parties will have no problems retaining Penang, Negeri Sembilan and Selangor in the Aug 12 state elections, PKR deputy president Rafizi Ramli said today.",2023-08-06,Politics
"Tok Mat:  BN-PH optimistic of retaining Negri Sembilan, Selangor and Penang,","SEREMBAN: Barisan Nasional (BN) is using the ‘retain and regain’ strategy in the six state elections to ensure the unity government can take control of all the states, said its deputy chairman Datuk Seri Mohamad Hasan.",2023-08-06,Politics
"Ignore racial and religious sentiments during state polls, says Tok Mat",KUALA LUMPUR: Voters have been urged to ignore racial and religious sentiments played up by certain parties in the state elections.,2023-08-06,Politics
"Ignore racial and religious sentiments during state polls, says Tok Mat",KUALA LUMPUR: Voters have been urged to ignore racial and religious sentiments played up by certain parties in the state elections.,2023-08-06,Politics
Voting is mandatory if other races are challenging Muslim's political power: Hadi,"KUALA LUMPUR: It is considered a jihad for Muslims to vote if their political power is being challenged by other races, said Pas president Tan Sri Abdul Hadi Awang.",2023-08-06,Politics
"Umno not our enemy or a party of infidels, says Hashim Jasin",KUALA LUMPUR: Pas spiritual leader Datuk Hashim Jasin today said the party does not consider Umno as its enemy or a party of infidels or non-believers. He said the Islamic party’s stand on the matter had long been decided and was final.   ,2023-08-06,Politics
PH-BN pact unveils election manifesto for Negri Sembilan,"SEREMBAN: The Pakatan Harapan (PN) and Barisan Nasional (BN) today unveiled the coalitions' joint election manifesto, which outlined their pledges to accelerate economic growth and transform Negri Sembilan into a modern state to improve the livelihood and wellbeing of the people.",2023-08-06,Politics
Amirudin: Selangor will continue to be biggest contributor to national GDP,"PETALING JAYA: Selangor is committed to continue being the biggest contributor to the nation’s gross domestic product, based on its three main thrusts of political and social stability, a pro-business policy and strength of human resources.",2023-08-06,Politics
Amirudin: Selangor voters shouldn't experiment,KUALA LUMPUR: Selangor voters are urged  not to experiment when voting  on Saturday.,2023-08-06,Politics
Asyraf Wajdi: Not joining Pas and not voting for Pas doesn't mean one is not Muslim,KUALA LUMPUR: Umno secretary-general Datuk Dr Asyraf Wajdi Dusuki has urged Pas leaders to issue a statement to correct the perception of their grassroots who believe that Umno is a party for infidels or non-believers.,2023-08-06,Politics
State elections to see higher young voter turnout,"GEORGE TOWN: The number of young voters (under 18) is expected to increase in the upcoming state elections after having cast their votes for the first time in the 15th general election (GE15) last year, said Deputy Minister of Youth and Sports, Adam Adli Abd Halim.",2023-08-06,Politics
"Helicopters, battleships, and rockets: Deciphering Pas, PN supporter's obsession with giant mimicry","KUALA LUMPUR: Come election season, all manners of giant replicas will sprout out in the Malay heartlands. ",2023-08-06,Politics
"Upko: Sabah, Sarawak endorse Anwar as PM","KOTA KINABALU:  In a unanimous decision, political parties from Sabah and Sarawak have expressed their support for Datuk Seri Anwar Ibrahim as prime minister, with no intention of changing the federal government.",2023-08-06,Politics
PKR's Lee falls unconscious in his office,"BUKIT MERTAJAM: Pakatan Harapan’s candidate for the Machang Bubok state seat, Lee Khai Loon, fell unconscious in his office here today. ",2023-08-06,Politics
State polls:  PN candidate Tengku Abdullah confident of victory in Gemencheh,"TAMPIN: Perikatan Nasional (PN) candidate for the N35 state seat, Tengku Abdullah Tengku Rakman, is confident of causing an upset in the contested seat on August 12. ",2023-08-06,Politics
Putrajaya has no clear direction; busy finding fault with others: Sanusi,"KUALA LUMPUR: Kedah caretaker Menteri Besar, Datuk Seri Muhammad Sanusi Md Nor claimed that the Putrajaya leadership is still lacking a clear direction in steering the country and is only busy finding faults in others, especially the opposition.  ",2023-08-06,Politics
"Lim perplexed by 'recent' allegations that he is anti-Malay, anti-Islam and a communist","KUALA LUMPUR:  After more than five decades of involvement in politics, DAP stalwart Tan Sri Lim Kit Siang is perplexed by 'recent' allegations that he is anti-Malay, anti-Islam and a communist. ",2023-08-06,Politics
Elections are not a contest to find the next entertainer on TikTok: Nurul Izzah,"LANGKAWI: Former member of parliament for Permatang Pauh, Nurul Izzah Anwar, urges voters to choose candidates who can represent the people's voices, rather than individuals who only know how to speak crudely and exhibit a 'loqlaq' attitude (Penang dialect for crude). ",2023-08-06,Politics
Analysts: Cyber campaigns more targeted,   3R ISSUES PLAYED UP,2023-08-06,Politics
"Kedah MB strikes back, denounces politicisation of REE issue","KUALA LUMPUR: Kedah caretaker Menteri Besar, Datuk Seri Muhammad Sanusi Md Nor, has addressed recent attacks against him, characterising them as politically motivated attempts to discredit his reputation. ",2023-08-06,Politics
Anwar will continue to drive Penang's progress- Zahid,"GEORGE TOWN: Deputy Prime Minister Datuk Seri Dr Ahmad Zahid Hamidi is confident that Penang, the birthplace of Datuk Seri Anwar Ibrahim, will continue to be driven by technological advancement under his leadership as the country’s prime minister.",2023-08-06,Politics
Hamzah: All our candidates are Negri Sembilan MB material,"KUALA PILAH: All Perikatan Nasional (PN) contesting in the polls in the state are qualified and meet the criteria to become the next Negri Sembilan Menteri Besar, the coalition’s secretary-general Datuk Seri Hamzah Zainuddin said.",2023-08-06,Politics
PN vows asset declaration if elected to power,KUALA LUMPUR: Perikatan Nasional (PN) assemblymen will declare their assets if given the mandate after the six states' elections. ,2023-08-06,Politics
PN vows asset declaration if elected to power,KUALA LUMPUR: Perikatan Nasional (PN) assemblymen will declare their assets if given the mandate after the six states' elections. ,2023-08-06,Politics
Anwar aims to turn Malaysia into a great economy in six years,GEORGE TOWN: Prime Minister Datuk Seri Anwar Ibrahim has declared that he aims to turn Malaysia into a great economy in five to six years.,2023-08-06,Politics
"State elections: See the bigger picture, Faizal Azumu tells Mukhriz","KUALA LUMPUR: Instead of questioning Perikatan Nasional’s (PN) call to join forces for election campaigns, Parti Pejuang Tanah Air (Pejuang) should instead see the ‘bigger picture’ and ensure PN wins big in the polls.",2023-08-06,Politics
Over 600 Bersatu members in Rantau Abang leave party for Umno,DUNGUN: More than 600 Bersatu members in the Rantau Abang state constituency today announced they were leaving the party to join Umno.,2023-08-05,Politics
"BN-PH cooperation in Penang among the best, says Zahid","BUTTERWORTH: The level of compatibility and cooperation between the Barisan Nasional (BN) and Pakatan Harapan (PH) machinery in Penang has been one of the best ahead of the state elections next Saturday (Aug 12), says BN chairman Datuk Seri Dr Ahmad Zahid Hamidi.",2023-08-05,Politics
Caretaker MB's sudden rescheduling sparks speculation in Padang Serai,PADANG SERAI: Caretaker Kedah Menteri Besar Datuk Seri Muhammad Sanusi Md Nor has rescheduled his attendance in Padang Serai today due to other engagements and not because he was required to give a statement to the police.,2023-08-05,Politics
[5 Questions For...] Azrul: Fielding Dominic Lau in Malay-majority seat a boon for PH,"KUALA LUMPUR:  Pakatan Harapan candidate for the Bayan Lepas state seat, Azrul Mahathir Aziz, is aware that going against a party president will be no mean feat.",2023-08-05,Politics
"Vote wisely for your future, Anwar tells young Malaysians",KEPALA BATAS: Prime Minister Datuk Seri Anwar Ibrahim has reminded young Malaysians to vote wisely in the upcoming state elections to ensure a secured future.,2023-08-05,Politics
[5 Questions For...] Dominic Lau: Peace restored in PN following ceramah snub,KUALA LUMPUR: Gerakan president Datuk Dominic Lau says “peace” has been restored among   Perikatan Nasional allies following the incident in which he was asked to leave a  Perikatan Nasional (PN) ceramah on Tuesday.,2023-08-05,Politics
Bold prediction: Ahmad Maslan foresees 6-0 victory for BN-PH pact in state polls,"JOHOR BARU: Umno Supreme Council member Datuk Seri Ahmad Maslan has offered bold insights into the upcoming state polls, suggesting a remarkable victory for the Pakatan Harapan (PH)-Barisan Nasional (BN) pact. ",2023-08-05,Politics
"Stop using govt facility for election campaigns, Bersih tells Anwar and his cabinet",KUALA LUMPUR: The prime minister and his ministers must refrain from using government machineries for their political campaigning purposes and pay for additional costs incurred if they were to use any of the facility during the election period. ,2023-08-05,Politics
State election: PN unveils Negri Sembilan election manifesto,"SEREMBAN: Optimising the use of abandoned ""tanah adat"" (native land), free Wifi internet hotspots and a slew of goodies for the youth were among the pledges brokered by Perikatan Nasional (PN) in its election manifesto.",2023-08-05,Politics
"I feel at peace with PN, says Noh",TANJONG KARANG: Tan Sri Noh Omar said life is more peaceful  with  Pas and Perikatan Nasional as compared with when he was in Umno.,2023-08-05,Politics
"Leaving Umno, an old-fashioned political tactic and method of psychological warfare: Asyraf Wajdi", ,2023-08-05,Politics
"Cancel Silicon Island reclamation project and I will withdraw from state election, says Oh",GEORGE TOWN: Penang Gerakan chairman Oh Tong Keong has challenged caretaker Chief Minister Chow Kon Yeow to cancel the Silicon Island reclamation project. ,2023-08-05,Politics
Amirudin: No plans to declare Aug 12 as public holiday,"SHAH ALAM: The state government has no plans to declare Aug 12 as a special public holiday to facilitate voters, particularly workers, to visit polling stations for the state election.",2023-08-05,Politics
Jazlan:  Resignations will not lead to Kelantan BN's collapse,KOTA BARU: The departure of several Ketereh Umno leaders and members to join Perikatan Nasional comes as no surprise to the state Barisan Nasional.,2023-08-05,Politics
"Mukhriz to PN: Why reject Pejuang, but request campaign support?",KUALA LUMPUR: Parti Pejuang Tanah Air president Datuk Seri Mukhriz Mahathir has expressed his bewilderment with Perikatan Nasional's call for his party to join forces with the coalition in the run-up to the state elections.,2023-08-05,Politics
Anwar dismisses Takiyuddin's PN wave prediction as a political statement,PRAI: Prime Minister Datuk Seri Anwar Ibrahim has brushed off Pas’ secretary-general Datuk Seri Takiyuddin Hassan statement on the Perikatan Nasional (PN) wave as a political statement. ,2023-08-05,Politics
Ayer Hangat indie candidate pledges ba'iah to Sanusi,"LANGKAWI: A former Pas member who is standing as an independent candidate for Ayer Hangat seat out of protest against the Perikatan Nasional candidate, has pledged “bai’ah” (oath of loyalty) to caretaker Menteri Besar Datuk Seri Muhammad Sanusi Md Nor. ",2023-08-05,Politics
Ayer Hangat indie candidate pledges ba'iah to Sanusi,"LANGKAWI: A former Pas member who is standing as an independent candidate for Ayer Hangat seat out of protest against the Perikatan Nasional candidate, has pledged “bai’ah” (oath of loyalty) to caretaker Menteri Besar Datuk Seri Muhammad Sanusi Md Nor. ",2023-08-05,Politics
Kelantan BN-PH announce 34 offer manifesto,KOTA BARU: Kelantan Barisan Nasional (BN) and Pakatan Harapan (PH) today announced its manifesto containing 34 offers for the people if the coalition captures Kelantan. ,2023-08-05,Politics
Juwairiya to woo BN hardcore supporters and the fence-sitters,"GOMBAK: With seven days left before polling day on Aug 12, Pakatan Harapan (PH) candidate for Hulu Kelang Juwairiya Zulkifli is set to go all out to win the heart of the hardcore Barisan Nasional (BN) supporters and the fence-sitters of the state constituency.  ",2023-08-05,Politics
"Anwar apologises to Taman Medan, Dusun Tua folks for missing events",KUALA LUMPUR: Prime Minister Datuk Seri Anwar Ibrahim has apologised to the residents of Taman Medan and Dusun Tua for his absence from the “Jelajah Perpaduan MADANI” at the two places on Thursday (Aug 3).,2023-08-05,Politics
PM Anwar responds to helicopter controversy,"SIK: Prime Minister Datuk Seri Anwar Ibrahim’s arrival in the rural areas of this state has drawn significant attention as he opted to use a helicopter, including for programs in Jeneri and Kupang last night. ",2023-08-05,Politics
BN-PH provides political stability: Johari,KUALA LUMPUR: Titiwangsa member of parliament Datuk Seri Johari Abdul Ghani called on voters in Selangor to put their trust in Pakatan Harapan (PH) and Barisan Nasional (BN) as they had a good track record governing the state.  ,2023-08-05,Politics
Anwar praises Zahid's actions in defending Umno,"ALOR STAR: Prime Minister Datuk Seri Anwar Ibrahim praised his deputy, Datuk Seri Dr Ahmad Zahid Hamidi for his bravery in defending Umno as a party that fights for independence. ",2023-08-05,Politics
Pas yet to decide on Pulai and Simpang Jeram seats,KOTA BARU: Pas has yet to decide whether to field its candidates in the Pulai and Simpang Jeram by-elections. ,2023-08-05,Politics
PN wave of support in Malay-majority seats?,"KUALA LUMPUR: While retaining Penang looks very much on the cards for Pakatan Harapan (PH) in the state election, it will by no means be a walk in the park.",2023-08-05,Politics
Infineon's €5 billion mega investment: Anwar proves his commitment to Kedah,"BALING: Prime Minister Datuk Seri Anwar Ibrahim highlighted the €5 billion investment in Kulim following his recent discussion with Infineon Technologies AG (Infineon), proving that he had no issue with Kedah.",2023-08-05,Politics
Anwar says Zahid is courageous for defending Umno,ALOR STAR: Prime Minister Datuk Seri Anwar Ibrahim today praised Umno president Datuk Seri Dr Ahmad Zahid Hamidi for his courage to defend his party during its turbulent years.,2023-08-05,Politics
"Isolated incident, moving forward PN to hold mega ceramah in show of unity, says Muhyiddin","SHAH ALAM: The fiasco where the Islamist party Pas asked Gerakan president Datuk Dominic Lau to leave its ceramah was an isolated case and shall not be repeated in the future, said Perikatan Nasional (PN) chairman Tan Sri Muhyiddin Yassin.",2023-08-05,Politics
