0,1,2,3
Guan Eng to Chow: Furnish proof of plot to topple you,GEORGE TOWN: DAP national chairman Lim Guan Eng has urged Penang Chief Minister Chow Kon Yeow to furnish proof of any plot to topple him.,2023-10-17,Politics
GPS to announce Jepak by-election candidate on Wednesday - Abang Johari,BINTULU: Gabungan Parti Sarawak (GPS) will announce its candidate for the Jepak state by-election on Wednesday.,2023-10-15,Politics
GPS to announce Jepak by-election candidate on Wednesday - Abang Johari,BINTULU: Gabungan Parti Sarawak (GPS) will announce its candidate for the Jepak state by-election on Wednesday.,2023-10-15,Politics
Upko reminds Sabah govt of state PH reps' support during Kinabalu Move,"PAPAR: The support from seven Sabah Pakatan Harapan (PH) assemblymen is the reason the government of the day is still intact, said Upko president Datuk Ewon Benedick.",2023-10-15,Politics
"No formal invitation to join unity government, says Tuan Ibrahim",KUALA LUMPUR: Pas claimed that the party didn't receive any formal invitation to join the unity government.,2023-10-15,Politics
Pas leader takes jab at Zahid's concerns over BN's influence in unity govt,"KUALA LUMPUR: A Pas leader has criticised Datuk Seri Ahmad Zahid Hamidi, saying that the latter is only concerned that Barisan Nasional (BN) will lose influence if Pas joins the unity government due to its liabilities.",2023-10-15,Politics
"Pas will remain as constructive opposition for the good of the people, says Pas veep","KOTA BARU: Pas today said the party is comfortable to remain as a constructive opposition in the government, for the good of the people.",2023-10-15,Politics
Zahid: Most suitable candidate will be selected for Kemaman,KUALA LUMPUR: The unity government will put forward the most suitable candidate who is well-accepted by the community in the Kemaman by-election.,2023-10-15,Politics
Pas should change attitude of entering into 'marriages of convenience',KUALA LUMPUR: Datuk Seri Dr Ahmad Zahid Hamidi urged Pas to change their attitude of entering into political “marriages of convenience”.,2023-10-15,Politics
"Kuala Kangsar MP is still with PN, Bersatu - Tuan Ibrahim","KUALA LUMPUR: Kuala Kangsar member of Parliament Datuk Iskandar Dzulkarnain Abdul Khalid is still part of Perikatan Nasional (PN) and Parti Pribumi Bersatu Malaysia (Bersatu), said Datuk Seri Tuan Ibrahim Tuan Man.",2023-10-13,Politics
Zahid denies Kuala Kangsar MP intimidated into supporting PM Anwar,KUALA LUMPUR: Datuk Seri Dr Ahmad Zahid Hamidi has denied claims that an opposition member of parliament was intimidated and threatened into supporting the leadership of Prime Minister Datuk Seri Anwar Ibrahim. ,2023-10-13,Politics
"Saifuddin denies Kuala Kangsar MP intimidated into supporting PM, tells Hamzah to stop making wild accusations",KUALA LUMPUR: Home Minister Datuk Seri Saifuddin Nasution Ismail has dismissed claims that an opposition member of parliament was intimidated and threatened into supporting the leadership of Prime Minister Datuk Seri Anwar Ibrahim.,2023-10-13,Politics
"Dr M's good relations with foreign countries will help improve economy of SG4, says Pas man",KOTA BARU: Pas is highly confident that the good relations between Tun Dr Mahathir Mohamad with foreign countries will be able to help improve the economy of the four states held by Perikatan Nasional (PN).,2023-10-12,Politics
Pas to name Kemaman candidate after EC announces by-election date,KOTA BARU: The decision on who to field for Pas in the Kemaman by-election will only be decided by the party's leadership upon the announcement of the by-election date by the Election Commission (EC). ,2023-10-12,Politics
"Felda schemes no longer BN's fix deposit, claims Sanusi","ALOR STAR: Perikatan Nasional election director Datuk Seri Muhammad Sanusi Md Nor says that Felda schemes are no longer fixed deposit for Barisan Nasional (BN), based on Saturday’s Pelangai by-election results. ",2023-10-11,Politics
EC to set dates for Kemaman by-election,KUALA LUMPUR: The Election Commission (EC) will set new dates for the Kemaman by-election following the Terengganu Election Court’s ruling to nullify Che Alias Hamid’s win over the parliamentary seat in the 15th General Election (GE15).  ,2023-10-11,Politics
Tan reminds DAP members to adhere to party's policy to refuse titles during active service,"KUALA LUMPUR: DAP has yet to call for a central executive committee (CEC) meeting to discuss its two leaders accepting honorary awards, said the party advisor Tan Kok Wai.",2023-10-10,Politics
Time to revisit DAP rule prohibiting elected reps from holding honorary titles,KUALA LUMPUR: A former DAP Central Executive Committee (CEC) leader and political analysts have proposed the party to revisit its rule prohibiting elected representatives from holding honorary titles. ,2023-10-10,Politics
"Actions should be taken against those who leak government confidential document, says Sabah LDP","KOTA KINABALU: Immediate action should be taken against those who leak confidential documents to irresponsible parties, said Liberal Democratic Party veep Sim Fui.  ",2023-10-10,Politics
'Saifuddin's claim that Felda voters are with PN not true': Fahmi,KUALA LUMPUR: Pakatan Harapan (PH) communication director Fahmi Fadzil refuted claims made by Pahang Perikatan Nasional (PN) chairman Datuk Seri Saifuddin Abdullah that Federal Land Development Authority (Felda) voters favoured PN in Pelangai.  ,2023-10-09,Politics
MCA's Pamela Yong: High Chinese voter turnout signals growing support for BN,KUALA LUMPUR: The results of the by-election in Pelangai revealed that Chinese voters have returned and reaffirmed their support for Barisan Nasional (BN).,2023-10-09,Politics
Alor Star MCA condemns rice policy for oppressing domestic farmers,KUALA LUMPUR: Alor Star MCA division chief Tan Chee Hiong has condemned the rice policy of the unity government because it oppresses domestic farmers in order to assist foreign farmers.,2023-10-09,Politics
Alor Star MCA condemns rice policy for oppressing domestic farmers,KUALA LUMPUR: Alor Star MCA division chief Tan Chee Hiong has condemned the rice policy of the unity government because it oppresses domestic farmers in order to assist foreign farmers.,2023-10-09,Politics
Zahid: Reduced majority in Pelangai due to slander against PH-BN candidate,KUALA LUMPUR: The Pakatan Harapan-Barisan Nasional candidate’s reduced majority during the recently concluded Pelangai by-election was due to slander by their opponents.,2023-10-09,Politics
PBB to propose increase in number of parliamentary constituency in Sarawak,BETONG: Parti Pesaka Bumiputera Bersatu (PBB) will set up a committee that will handle and put forward a proposal to increase the number of parliamentary constituencies in Sarawak.,2023-10-08,Politics
"After receiving 47 votes,  Pelangai independent candidate says defeat was expected",BENTONG: Independent candidate Haslihelmy DM Zulhasni described his 'thrashing' in the Pelangai state seat by-election yesterday as expected.,2023-10-08,Politics
"Felda voters seem to favour PN in Pelangai, with PN wins in two Felda polling centres","BENTONG: Despite being defeated in the Pelangai state seat by-election yesterday, the Malay vote swing trend in Felda schemes have been in favour of Perikatan Nasional(PN).",2023-10-08,Politics
DAP CEC to decide action on two members who received Datukship,"KUALA LUMPUR: The DAP Central Executive Committee (CEC) will decide on action against its two leaders after they received awards, decorations, and medals of honour from the Yang Dipertua of Sabah Tun Juhar Mahiruddin yesterday.",2023-10-08,Politics
Anwar: Pelangai win proof of unity govt prevailing over slander and racism,"KUALA LUMPUR: The unity government's win in the Pelangai by-election has shown that they have managed to break down the politics of slander and racism, said Datuk Seri Anwar Ibrahim.",2023-10-08,Politics
Amizar promises to continue late Johari's legacy in Pelangai,"BENTONG: Fresh after securing victory in the Pelangai by-election, Barisan Nasional's (BN) Datuk Amizar Abu Adam has pledged to continue the good work of former elected representative Datuk Seri Johari Harun.",2023-10-08,Politics
"Pelangai win puts a dent to PN's green wave aspiration, says Pahang Umno chief",BENTONG: The Pelangai state by-election outcome favouring Barisan Nasional (BN) proves the coalition has successfully stopped Perikatan Nasional (PN) 's `green wave' sentiments in Pahang.,2023-10-07,Politics
"Official results: BN secures victory in Pelangai with 2,949 majority","BENTONG: Barisan Nasional (BN) has retained the Pelangai state seat with a 2,949 majority, a dip compared to the outcome in the 15th General Election.",2023-10-07,Politics
[Updated] Unofficial results: BN retains Pelangai state seat for the 10th time,"BENTONG: In a significant electoral contest, Kasim Samat of Perikatan Nasional (PN) appears to have faced another setback as unofficial results from the Pelangai state seat by-election today indicate a loss.",2023-10-07,Politics
Unofficial results: BN takes the lead in Pelangai,BENTONG: Unofficial results showed Barisan Nasional's Datuk Amizar Abu Adam is leading in the three-cornered battle for the Pelangai state seat by-election. ,2023-10-07,Politics
"Pelangai polls end at 6pm, all eyes on vote-counting process","BENTONG: BENTONG: The polling for the Pelangai state seat, which commenced at 8am today, has officially concluded, with all nine polling centres in the constituency closing their doors at 6pm.",2023-10-07,Politics
Pelangai voter turnout nearly 70 per cent as at 4pm,"BENTONG: The Pelangai state seat by-election continues to see an encouraging voter turnout, recording 69 per cent as at 4pm, nearing the 70 per cent target set by the Election Commission (EC).",2023-10-07,Politics
"Pelangai by-election: No transport, no problem as Pahang MB helps ferry voters","BENTONG: Elderly voters in the Pelangai state seat constituency were today presented with the rare opportunity to ride in vehicles driven by Pahang Barisan Nasional (BN) politicians, including Pahang Menteri Besar Datuk Seri Wan Rosdy Wan Ismail.",2023-10-07,Politics
'There's no need: Race-based parties a thing of the past'- Batu MP,"KUALA LUMPUR: There is no need to form an independent race based political party, says Batu member of parliament P. Prabakaran. ",2023-10-07,Politics
Pelangai by-election: Voter turnout exceeds 50 per cent at 1pm,"BENTONG: The voter turnout for the Pelangai state seat by-election continues to display a promising trend, reaching 53 per cent as of 1pm today.",2023-10-07,Politics
"Youths stage 'free Najib"" flash mob at PN ceramah in Pelangai",BENTONG: A group of youths caused a stir at a Perikatan Nasional (PN) 'Mega Ceramah' at Dataran Purnama here tonight (October 6) when they staged a flash mob calling for the release of former prime minister Datuk Seri Najib Tun Razak.,2023-10-07,Politics
PN: Zahid's claims baseless; there'll be no defectors to PH-BN,"KUALA LUMPUR: Perikatan Nasional is confident that none of their leaders in Pahang will defect to the Pakatan Harapan-Barisan Nasional (PH-BN) unity government, as alleged by Datuk Seri Dr Ahmad Zahid Hamidi on Thursday. ",2023-10-06,Politics
Tun M meets with Kelantan leaders as SG4 adviser,KOTA BARU: Tun Dr Mahathir Mohamad today held a meeting with Kelantan Menteri Besar Datuk Mohd Nassuruddin Daud and his state executive councillors.,2023-10-06,Politics
Tun M meets with Kelantan leaders as SG4 adviser,KOTA BARU: Tun Dr Mahathir Mohamad today held a meeting with Kelantan Menteri Besar Datuk Mohd Nassuruddin Daud and his state executive councillors.,2023-10-06,Politics
Pelangai by-election: Felda youths must see how the schemes have changed for the better,"BENTONG: The younger generation of Felda settlers must take a moment to reflect on how the schemes had transformed the lives of many, including the first generation of settlers, before casting their ballots in the Pelangai by-election tomorrow.",2023-10-06,Politics
"Pelangai by-election: Result expected by 9pm, says EC",BENTONG: The official result for the Pelangai state by-election will be known by 9pm tomorrow.,2023-10-06,Politics
"BN appears to be in 'panic mode' for Pelangai polls, claims Pahang Pas chief","BENTONG: Pahang Pas has claimed that Barisan Nasional seems to be nervous in facing the Pelangai state by-election tomorrow, despite the fact that no other coalition had previously won in the constituency.",2023-10-06,Politics
Pelangai by-election campaign enters final day; PN 'top guns' in town tonight,"BENTONG: After almost two weeks of “marathon” campaigning, the Pelangai state by-election featuring three candidates enters its final day before ending at the stroke of midnight today.",2023-10-06,Politics
Pahang BN ready to be investigated over misuse of govt assets in campaign claims,BENTONG: Pahang Barisan Nasional (BN) is ready to be investigated by the Election Commission (EC) regarding claims that the coalition used state government assets and machinery during the ongoing Pelangai state seat by-election campaign period.,2023-10-05,Politics
Amizar says no comment about being elected as Pahang exco if he wins in Pelangai,"BENTONG: Barisan Nasional’s candidate for the Pelangai state seat by-election, Datuk Amizar Abu, has refused to be drawn into talk that he will be appointed as a Pahang state executive council member if he secures victory on Oct 7.",2023-10-05,Politics
"Several Pahang PN state assemblymen may defect to PH-BN, says Zahid","PUTRAJAYA: Some Perikatan Nasional (PN) state assemblymen in Pahang might defect the coalition to join the Pakatan Harapan and Barisan Nasional (PH-BN) pact, said Datuk Seri Dr Ahmad Zahid Hamidi today. ",2023-10-05,Politics
"Pelangai by-election: Level playing field, voter participation, and sentiments are key factors in determining the victor","BENTONG: Barisan Nasional (BN) should be in the driver's seat to retain the Pelangai by-election for the tenth time, but concerns have been expressed about the possibility of a low voter turnout on election day.",2023-10-05,Politics
Pelangai by-election: Loke denies Chinese community not going out to vote,"BENTONG: DAP secretary-general Anthony Loke  has denied the allegation that the Chinese community, especially in Telemong and Kampung Baru here, will not go out to vote in the Pelangai state by-election this Saturday.",2023-10-05,Politics
Pelangai indie candidate faces bumpy by-election campaign,"BENTONG: Former Umno member Haslihelmy DM Zulhasli's move to contest solo in the Pelangai by-election did not go over well with certain parties, who are attempting to undermine his ambitions.",2023-10-05,Politics
Pas struggles to attract Pelangai constituents to attend ceramah,BENTONG: Pas acknowledged that it has been challenging to entice Pelangai constituents to attend ceramah held during the campaign period for the forthcoming by-election.,2023-10-05,Politics
"Hamzah: I'm okay with Muhyiddin, we have no issues","BENTONG: Datuk Seri Hamzah Zainudin has refuted rumours that he will challenge Tan Sri Muhyiddin Yassin for the presidency, which are said to be causing discontent and discord within the Parti Pribumi Bersatu Malaysia (Bersatu) party.",2023-10-05,Politics
Experts: Pas downplaying corruption allegations,KUALA LUMPUR: Political analysts say Pas’ decision not to appeal the election court’s annulment of the 15th General Election (GE15) result for the Kemaman parliamentary constituency is a strategy to downplay corruption allegations. ,2023-10-05,Politics
It's the traditional method of door-to-door campaigning for PN's Pelangai hopeful 'Cikgu Kasim',"BENTONG: Kasim Samat, Perikatan Nasional’s candidate for the Pelangai by-election, has adopted a traditional campaigning method, namely by going door-to-door to meet voters. ",2023-10-04,Politics
"Felda Chemomoi has potential as hub for bird-related industries and tourism, says BN's Pelangai candidate","BENTONG: The Pelangai constituency, particularly Felda Chemomoi, has the potential to be developed as a hub for bird-related industries and serve as a tourist attraction.",2023-10-04,Politics
Amanah VP Mujahid racks up the miles campaigning for BN's Pelangai candidate,"BENTONG: Parti Amanah Negara (Amanah) vice-president Datuk Seri Dr Mujahid Yusof Rawa is making his presence felt on the campaign trail, lending his support to Barisan Nasional (BN) candidate Datuk Amizar Abu Adam in the ongoing Pelangai by-election. ",2023-10-04,Politics
Tuan Ibrahim denies report Pas will field Dr M for Kemaman by-election,KUALA LUMPUR: Pas deputy president Datuk Seri Tuan Ibrahim Tuan Man has refuted claims that the party will field Tun Dr Mahathir Mohamad as candidate for the Kemaman parliamentary by-election. ,2023-10-04,Politics
BN aims to reduce Pas' majority if it contests in Kemaman by-election,PUTRAJAYA: Barisan Nasional (BN) may try its luck to wrest the Kemaman  despite a bleak chance of it to win in the parliamentary seat.,2023-10-03,Politics
"[Updated] No signs of an impending cabinet reshuffle as of 5pm, says Zahid",PUTRAJAYA: Deputy Prime Minister Datuk Seri Dr Ahmad Zahid Hamidi has shot down talk that a cabinet reshuffle would be announced tomorrow. ,2023-10-03,Politics
"[Updated] No signs of an impending cabinet reshuffle as of 5pm, says Zahid",PUTRAJAYA: Deputy Prime Minister Datuk Seri Dr Ahmad Zahid Hamidi has shot down talk that a cabinet reshuffle would be announced tomorrow. ,2023-10-03,Politics
"After slow start, PN embarks on strategic approach to woo Chinese, Indian voters in Pelangai",BENTONG: Lukewarm support from non-Malay voters in the Pelangai by-election has prompted Perikatan Nasional(PN) to introduce specially tailored campaign approaches in a bid to win the hearts and minds of the community.,2023-10-03,Politics
"Promotion to senior ministerial position depends on PM, says Amanah's Adly Zahari",PUTRAJAYA: Deputy Defence Minister Adly Zahari said that the decision to promote him to a senior ministerial position would rest on the prime minister.,2023-10-03,Politics
Hannah Yeoh rubbishes claims of possible cabinet role reshuffle,KUALA LUMPUR: Youth and Sports Minister Hannah Yeoh has refuted claims of being moved out of her present administerial role within the ministry.,2023-10-03,Politics
"Appoint Umno youth chief into cabinet, says party division youth leader",ALOR STAR: An Umno youth leader has endorsed party youth chief Dr Muhamad Akmal Saleh as a fitting candidate for a cabinet appointment in the event of a cabinet reshuffle. ,2023-10-03,Politics
Anwar: Jealous quarters want to break up Unity Govt [NSTTV],BENTONG: Prime Minister Datuk Seri Anwar Ibrahim said some parties are uneasy and want to break up the Unity Government because they are jealous of the coalition’s strength.,2023-10-03,Politics
Penang Umno yet to submit names for councillor posts,"GEORGE TOWN: The state government has confirmed that Penang Umno has yet to submit names for the Penang Island City Council (MBPP) councillor post, resulting in none of its candidates present for the swearing in ceremony here today.",2023-10-02,Politics
"Pelangai indie candidate switches focus to Felda schemes, traditional villages","BENTONG: After being given the cold shoulder in non-Malay majority areas during the Pelangai by-election campaign, independent candidate Haslihelmy DM Zulhasli has decided to solely focus on Felda schemes and traditional villages to canvass for votes.",2023-10-02,Politics
Young voters' support and disgruntled groups could prove vital for PN in Pelangai battle,"BENTONG: Less than a week before polling day, Perikatan Nasional (PN) is anticipating the winds of change blowing in its favour for the Pelangai state seat by-election on Oct 7.",2023-10-02,Politics
"Pick candidate who will serve as 'bridge' between Pelangai and state, federal govt, says Umno VP",BENTONG: Voters in the Pelangai state constituency have to be cautious with promises made by the opposition in their attempt to canvass for votes in the Oct 7 by-election.,2023-10-02,Politics
"CSR, durian cultivation hub in Pelangai tops Amizar's wish list for constituency",BENTONG: Reviving the toll-free Central Spine Road (CSR) through Simpang Pelangai here and turning Pelangai into a premier durian cultivation hub is top on the list of priorities for Barisan Nasional(BN) candidate Datuk Amizar Abu Adam.,2023-10-01,Politics
"Give unity government more time to achieve desirable results, says Umno V-P [NSTTV]",BENTONG: The 10-month-old unity government should be given more time to steer the country to greater heights including time to prove its effectiveness in administering the country.,2023-10-01,Politics
"Pelangai by-election: Police presence is nothing to worry about, says Saifuddin [NSTTV]","KUALA LUMPUR: Heavy police presence during political campaigns ahead of the Pelangai by-election is nothing concerning, said Home Minister Datuk Seri Saifuddin Nasution Ismail. ",2023-10-01,Politics
Pas deputy president denies no-contest decision on party's top five posts,"KUALA LUMPUR: Pas today denied issuing a directive for having no contests for the party’s top five posts in the party polls, said its deputy president Datuk Seri Tuan Ibrahim Tuan Man.   ",2023-10-01,Politics
Johari: Don't pressure PM on cabinet reshuffle issue [NSTTV],BENTONG: Cabinet reshuffle is the prerogative of Prime Minister Datuk Seri Anwar Ibrahim and any decision on the matter solely lies with him.,2023-10-01,Politics
"More than 2,000 Pelangai voters living in KL identified, says Amirudin Shari","KUALA LUMPUR: The Pahang Pakatan Harapan (PH) identified over 2,000 voters for the upcoming Pelangai by-election who are currently living in Kuala Lumpur.  ",2023-10-01,Politics
"Lack of financial resources not an excuse to avoid honouring MA63 pledges, says Shafie","KOTA KINABALU: The federal government should not use the lack of financial resources as an excuse for not giving to Sabah 40 per cent of revenue collected from the state, said Datuk Seri Mohd Shafie Apdal.",2023-09-30,Politics
BN ready to contest in Kemaman if by-election is held - Zahid,"BENTONG: Barisan Nasional (BN) is ready to contest in the Kemaman parliamentary by-election, if it is held, after the Election Court nullified Pas candidate Che Alias Hamid’s victory in the 15th General Election (GE15).",2023-09-30,Politics
Pas decision not to contest 'Top 5' posts no surprise to Umno - Noor Hariri,KOTA BARU: Kelantan Umno said  Pas's decision not to contest the top five positions in the party's upcoming 69th Annual Muktamar next month was expected.,2023-09-30,Politics
Pas muktamar: 'Top 5' retain posts without contest  - Takiyuddin,"KUALA LUMPUR: The top five leaders of Pas will be returned unopposed at the party’s 69th Annual Muktamar from Oct 20 to 22, said Pas secretary-general Datuk Seri Takiyuddin Hassan.",2023-09-29,Politics
Pas muktamar: 'Top 5' retain posts without contest  - Takiyuddin,"KUALA LUMPUR: The top five leaders of Pas will be returned unopposed at the party’s 69th Annual Muktamar from Oct 20 to 22, said Pas secretary-general Datuk Seri Takiyuddin Hassan.",2023-09-29,Politics
Pas may field Che Alias again in Kemaman,KUALA LUMPUR: Pas did not rule out the possibility of fielding Che Alias Hamid again if a by-election is called for the Kemaman parliamentary seat in Terengganu.,2023-09-29,Politics
BN candidate outlines three strategies to empower youths in Pelangai,"BENTONG: Barisan Nasional (BN) candidate Datuk Amizar Abu Adam has outlined the 3P strategies - ‘pendapatan’ (income), ‘perumahan’ (housing) and ‘penyediaan infrastruktur’ (infrastructure) to empower the youths in the Pelangai state constituency.",2023-09-28,Politics
BN needs Pelangai win to balance its position in state assembly: Observers,"BENTONG: Halfway through the campaign period for the Pelangai state by-election, the contest for the seat, supposedly a three-cornered fight, is seeing a rivalry between only two of the candidates, Umno representing Barisan Nasional (BN) and Pas for Perikatan Nasional (PN).",2023-09-28,Politics
"""I will still carry the responsibility while I have it,"" Naim says over possible cabinet reshuffle",PUTRAJAYA: Minister in the Prime Minister’s Department (Religious Affairs) Datuk Dr Mohd Na’im Mokhtar today said he was still fulfilling his duty as a cabinet member despite rumours of a possible cabinet reshuffle. ,2023-09-28,Politics
Victory in Pelangai crucial to build BN's confidence in GE16 - Tok Mat,"BENTONG: The Pelangai state by-election is a battleground that Barisan Nasional (BN) needs to win to build the coalition’s confidence for the 16th General Election (GE16), said Umno deputy president Datuk Seri Mohamad Hasan.",2023-09-28,Politics
"Pelangai indie candidate relying on family members to campaign, adopts door-to-door approach",BENTONG: Independent candidate Haslihelmy DM Zulhasli appears to be fighting his own battle in his quest to cause an upset in the Pelangai by-election on Oct 7.,2023-09-27,Politics
Sanusi: I am not running for Pas VP,ALOR STAR: Perikatan Nasional (PN) election director Datuk Seri Muhammad Sanusi Md Nor has shot down suggestions to nominate him in the race for Pas vice-president post during the 69th party delegates assembly next month.,2023-09-27,Politics
Pas will defend Kemaman parliamentary seat again if there is by-election - Ahmad Fadhli,KUALA LUMPUR: Pas youth chief Ahmad Fadhli Shaari said that he respects the court's decision in annulling the party’s victory for the Kemaman parliamentary seat and leaves it to the leadership to appeal on the matter.,2023-09-27,Politics
